CATEGORY,BRAND,NAME,INSTOCK,SUBCATEGORY,MRP,WEIGHT,SKINTYPES,SENSITIVITYSAFE,CONCERNADDRESSED,KEYINGREDIENTS,FULLINGREDIENTLIST,GENDER,TEXTURE,CLIMATESUITABILITY,PREFERENCES,USAGE,FREQUENCY,DESCRIPTION,BENEFITS,INSTRUCTIONS,RATING, SHOPIFYVARIANTID,SHOPIFYPRODCUTID
MASKS & PEELS,JM Solution,Pure Fish Collagen Green Mask 30ml,TRUE,Sheet Mask,? 250,30 ml,sensitive,TRUE,"acne,redness,sensitivity","hydrolyzed-collagen,tea-tree-extract,centella-asiatica","water,butylene-glycol,glycerin,phenoxyethanol,allantoin,carbomer,triethanolamine,peg-60-hydrogenated-castor-oil,trehalose,ethylhexylglycerin,betaine,hydroxyethylcellulose,disodium-edta,fragrance,glyceryl-acrylate/acrylic-acid-copolymer,1,2-hexanediol,sodium-hyaluronate,hydrolyzed-collagen-(10ppm),polysorbate-60,disodium-phosphate,ci-19140,ci-42090,sodium-phosphate,caprylic/carpic-triglyceride,melaleuca-alternifolia-(tea-tree)-leaf-extract,houttuynia-cordata-extract,rosmarinus-officianalis-(rosemary)-ract,centella-asiatica-extract,ceramide-np,poncirus-trifoliata-fruit-extract,morus-bombycis-extract,forsythia-suspensa-fruit-extract,inula-britannica-flower-extract,viscum-album-(mistletoe)-extract,aspergillus-ferment,lactobacillus-ferment,camellia-sinensis-leaf-extract,hydrogenated-lecithin,brassica-oleracea-italica-(broccoli)-extract",neutral,sheet,hot-humid,"soothing,calming,barrier-support,cooling",evening,as-needed,"The 'Green' version of the Fish Collagen mask, designed for sensitive and irritated skin. It combines collagen with Tea Tree and Cica to soothe redness while firming.","Calms inflamed skin, reduces redness, hydrates without clogging pores, restores balance.",Apply to face when skin feels heated or irritated. Leave for 15 mins.,4.5,41501959454755,7176836546595
MASKS & PEELS,JM Solution,Pure Fish Collagen Pink Mask 30ml,TRUE,Sheet Mask,? 250,30 ml,dry,TRUE,"dryness,dullness,loss-of-elasticity","hydrolyzed-collagen,niacinamide,allantoin","water,glycerin,butylene-glycol,glycerth-26,glyceryl-acrylate-/-acrylic-acid-copolymer,1,2-hexanediol,phenoxyethanol,hydroxyethylcellulose,disodium-phosphate,sodium-phosphate,polysorbate-60,allantoin,trehalose,peg-60,hydrogenated-castor-oil,sodium-hyaluronate,hydrolyzed-hyaluronic-acid,hydroxy-propyltrimonium-hyaluronate,sodium-acetylated-hyaluronate,carbomer,triethanolamine,ethylhexylglycerin,disodium-edta,poncirus-trifoliate-fruit-extract,inula-britannica-flower-extract,forsythia-suspensa-fruit-extract,viscum-album-(mistletoe)-extract,morus-bombycis-extact,lactobacillus-ferment,aspergillus-ferment,fragrance,hydrolyzed-collagen-(10ppm),biotin,panthenol,thiamine-hcl,cyanocobalamin,riboflavin,pyridoxine,folic-acid,menadione,bioflavonoids,ascorbic-acid,tocopherol-acetate-retinyl-palmitate,camellia-japonica-flower-extract,punica-granatum-fruit-extract,gardenia-florida-fruit-extract,beta-vulgaris-(beet)-root-extract,rosa-damascena-extract,ci-16185,ci-15985",neutral,sheet,dry,"firming,glow-boosting,moisturizing",evening,weekly,"A firming mask from the Pure Fish Collagen line. The 'Pink' version focuses on boosting elasticity and radiance for tired, limp skin.","Improves skin bounce, provides instant glow, hydrates deeply without stickiness.",Place mask on face. Remove after 10-20 mins. Pat essence into skin.,4.4,41501959487523,7176836579363
CLEANSERS,Beauty of Joseon,Radiance Cleansing Balm,TRUE,Cleansing Balm,"? 1,580",100 g,,TRUE,"dryness,pores","rice-bran-water,grain-complex,chrysanthemum-extract","cetyl-ethylhexanoate,caprylic/capric-triglyceride,peg-20-glyceryl-triisostearate,synthetic-wax,peg-10-isostearate,lactobacillus/soybean-ferment-extract,hippophae-rhamnoides-oil,oryza-sativa-(rice)-bran-oil,oryza-sativa-(rice)-seed-water,avena-sativa-(oat)-meal-extract,coix-lacryma-jobi-ma-yuen-seed-extract,oryza-sativa-(rice)-extract,water,sorbitan-sesquioleate,glycerin,propanediol,butylene-glycol,1,2-hexanediol,caprylyl-glycol,ethylhexylglycerin",neutral,sherbet-balm,all,"fragrance-free,non-stripping,melting,double-cleanse",evening,daily,"Remove dirt and makeup effectively with Beauty of Joseon Radiance Cleansing Balm. This gentle balm is formulated with rice bran and grain extracts that melts away even the most stubborn makeup, impurities, and excess sebum without stripping your skin.","Melts waterproof makeup, retains moisture, brightens skin, gentle on eyes.",Scoop a coin-sized amount onto dry hands. Massage onto dry face to melt makeup. Emulsify with water and rinse.,4.6,41501959520291,7176836612131
MOISTURIZERS,Cathy Doll,Red Rule Perfume Lotion,TRUE,Body Lotion,? 999,150 ml,,FALSE,"aging,dryness,dullness","pomegranate-seed-extract,vitamin-e,vitamin-c,arbutin","aqua,fragrance,cetearyl-alcohol,glyceryl-stearate,mineral-oil,peg-100-stearate,allantoin,phenoxyethanol,dimethicone,carbomer,triethanolamine,polyacrylamide,methylparaben,c13-14-isoparaffin,propylparaben,xanthan-gum,laureth-7,alpha-arbutin,ascorbic-acid,punica-granatum-seed-oil,tocopherol,ci-16035",female,lotion,all,"bold-scent,anti-aging,brightening,hydrating",both,daily,"Cathy Doll Red Rule Perfume Lotion is more than just skincare—it’s a statement piece in your routine. This lotion drenches skin in hydration, helping it stay soft, supple, and never sticky, while brightening care reveals glowing skin with a radiant finish. Infused with a floral scent that feels bold yet elegant, it transforms ordinary moisturization into a sensory experience. Over time, it works to enhance skin’s radiance, leaving behind moisture, confidence, and an unforgettable trail of allure.","Bold fragrance, revitalizes rough skin, brightens, improves elasticity.",Apply to body for a statement scent and hydration.,4.5,41501959553059,7176836644899
SUNSCREENS,Beauty of Joseon,Relief Sun: Rice + Probiotics SPF50+ PA++++,TRUE,Chemical Sunscreen,"? 1,500",50 ml,"dry,normal,sensitive",TRUE,"dryness,sun-protection","rice-extract,grain-ferment-extracts,niacinamide","water,oryza-sativa-(rice)-extract-(30%),dibutyl-adipate,propanediol,diethylamino-hydroxybenzoyl-hexyl-benzoate,polymethylsilsesquioxane,ethylhexyl-triazone,niacinamide,methylene-bis-benzotriazolyl-tetramethylbutylphenol,coco-caprylate/caprate,caprylyl-methicone,diethylhexyl-butamido-triazone,glycerin,butylene-glycol,oryza-sativa-(rice)-germ-extract,camellia-sinensis-leaf-extract,lactobacillus/pumpkin-ferment-extract,bacillus/soybean-ferment-extract,saccharum-officinarum-(sugarcane)-extract,macrocystis-pyrifera-(kelp)-extract,cocos-nucifera-(coconut)-fruit-extract,panax-ginseng-root-extract,camellia-sinensis-leaf-extract,monascus/rice-ferment,pentylene-glycol,behenyl-alcohol,poly-c10-30-alkyl-acrylate,polyglyceryl-3-methylglucose-distearate,decyl-glucoside,tromethamine,carbomer,acrylates/c10-30-alkyl-acrylate-crosspolymer,1,2-hexanediol,sodium-stearoyl-glutamate,polyacrylate-crosspolymer-6,ethylhexylglycerin,adenosine,xanthan-gum,tocopherol,lactobacillus/rice-ferment,aspergillus-ferment,saccharomyces/rice-ferment-filtrate",neutral,lightweight-lotion,all,"no-white-cast,moisturizing,non-sticky,reef-safe",morning,daily,"Nourish, protect and brighten your skin with Beauty of Joseon Relief Sun. This lightweight, creamy sunscreen offers broad-spectrum SPF 50+ PA++++ protection while delivering essential hydration and nourishment to your skin.","High sun protection, moisturizes like a cream, leaves a dewy finish, soothing.",Apply generously 15 minutes before sun exposure. Reapply every 2 hours.,4.7,41501959585827,7176836677667
OTHER,Beauty of Joseon,Revive Eye Serum: Ginseng + Retinal,TRUE,Eye Serum,"? 1,420",30 ml,,FALSE,"dark-circles,fine-lines,loss-of-elasticity","ginseng-root-extract,retinal,niacinamide,cholesterol","water,panax-ginseng-root-extract,glycerin,dipropylene-glycol,caprylic/capric-triglyceride,1,2-hexanediol,pentaerythrityl-tetraethylhexanoate,niacinamide,butylene-glycol-dicaprylate/dicaprate,cetearyl-alcohol,sorbitan-olivate,ceterayl-olivate,butylene-glycol,hydrogenated-lecithin,tromethamine,carbomer,glyceryl-stearate,macadamia-ternifolia-seed-oil,ethylhexylglycerin,adenosine,theobroma-cacao-(cocoa)-extract,dextrin,cholesterol,polyglyceryl-10-oleate,disodium-edta,retinal,brassica-campestris-(rapeseed)-sterols,phytosteryl/behenyl/octyldodecyl-lauroyl-glutamate,silica,sodium-hyaluronate,tocopherol,aluminum/magnesium-hydroxide-stearate,potassium-cetyl-phosphate,pentaerythrityl-tetra-di-t-butyl-hydroxyhydrocinnamate,ceramide-np,palmitoyl-tripeptide-5",neutral,creamy-serum,all,"anti-aging,retinal-liposome,gentle-active,fragrance-free",evening,daily,"Re-energize tired eyes and reduce wrinkles with Beauty of Joseon Revive Eye Serum. Its potent formula combines ginseng extract and retinal to target wrinkles, puffiness, dark circles, and loss of elasticity in the delicate eye area.","Reduces wrinkles and fine lines, improves elasticity, hydrates eye area.",Pump 1-2 times and pat around the eyes. Use at night. Use SPF the next day.,4.3,41501959618595,7176836710435
SERUMS & AMPOULES,Beauty of Joseon,Revive Serum: Ginseng + Snail Mucin,TRUE,Repair Serum,"? 1,400",30 ml,dry,TRUE,"dullness,fine-lines,loss-of-elasticity","ginseng-root-water,snail-secretion-filtrate,niacinamide","panax-ginseng-root-water,water,butylene-glycol,snail-secretion-filtrate,dipropylene-glycol,1,2-hexanediol,glycerin,niacinamide,propanediol,trehalose-carbomer,tromethamine,xanthan-gum,centella-asiatica-extract,ganoderma-lucidum(mushroom)-extract,panax-ginseng-root-extract,malt-extract,sodium-polyacrylate,adenosine,glyceryl-acrylate/acrylic-acid-copolymer,disodium-edta,phellinus-linteus-extract,sodium-hyaluronate,hydrolyzed-hyaluronic-acid,forsythia-suspensa-fruit-extract,lonicera-japonica(honeysuckle)-flower-extract,scutellaria-baicalensis-root-extract,sodium-acetylated-hyaluronatee",neutral,silky-fluid,cold-dry,"anti-aging,repairing,nourishing,fragrance-free",both,daily,"Deeply hydrate and improve aging skin concerns with the Beauty of Joseon Revive Serum. Formulated with ginseng and snail mucin, it works harmoniously to restore your skin's vitality, elasticity, and promote a youthful glow.","Improves wrinkles, boosts elasticity, deeply nourishes, repairs skin barrier.",Apply 2-3 drops to face and neck. Pat gently.,5,41501959651363,7176836743203
MOISTURIZERS,The Face Shop,Rice & Ceramide Moisturizing Cream,TRUE,Face Cream,"? 1,040",50 ml,"dry,normal,sensitive",TRUE,"dryness,dullness","rice-extract,ceramide-np,shea-butter","water/eau,glycerin,dipropylene-glycol,cyclopentasiloxane,caprylic/capric-triglyceride,behenyl-alcohol,betaine,neopentyl-glycol-diheptanoate,tri-c14-15-alkyl-citrate,stearic-acid,1-2-hexanediol,cetearyl-olivate,oryza-sativa-(rice)-extract,octyldodecyl-lactate,diisostearyl-malate,oryza-sativa-(rice)-bran-oil,ceramide-np,glycosphingolipids,butyrospermum-parkii-(shea)-butter,sorbitan-olivate,peg-100-stearate,glyceryl-stearate,isoceteth-25,isoceteth-10,dimethicone/vinyl-dimethicone-crosspolymer,polyacrylate-13,dimethicone,cyclomethicone,polyisobutene,polysorbate-20,sodium-hyaluronate,polyglyceryl-10-oleate,lecithin,trisodium-edta,caprylic/capric-glycerides,ethylhexylglycerin,phenoxyethanol,parfum/fragrance",neutral,rich-cream,cold-dry,"deep-moisture,barrier-repair,brightening,softening",evening,daily,"The Face Shop Rice & Ceramide Moisturizing Cream is a rich, skin-softening daily cream made to deliver deep moisture, lasting softness, and a healthy glow. Formulated with 100% Korean Rice Extract and Ceramides, this cream helps strengthen the moisture barrier while keeping skin smooth, plump, and protected all day. The silky texture glides on effortlessly, absorbs without heaviness, and leaves a comfortable finish that works in every season.","Provides deep hydration, strengthens skin barrier, prevents moisture loss, softens texture.",Apply as the last step of skincare. Massage gently.,4.8,41501959684131,7176836775971
MOISTURIZERS,The Face Shop,Rice & Ceramide Moisturizing Emulsion,TRUE,Emulsion,? 990,150 ml,"dry,normal",TRUE,"dryness,dullness,pigmentation","rice-extract,ceramide-np,rice-bran-oil","water,glycerin,alcohol,dipropylene-glycol,caprylic/capric-triglyceride,hydrogenated-polydecene,betaine,cyclomethicone,cetyl-ethylhexanoate,polyglyceryl-3-methylglucose-distearate,di-c12-13-alkyl-malate,oryza-sativa-(rice)-extract,cetearyl-alcohol,glyceryl-stearate,peg-100-stearate,butyrospermum-parkii-(shea-butter),dimethicone,lecithin,caprylic/capric-glycerides,dimethicone/vinyl-dimethicone-crosspolymer,oryza-sativa-(rice)-bran-oil,acrylates/c10-30-alkyl-acrylate-crosspolymer,butylene-glycol,c12-14-pareth-12,sodium-hyaluronate,ceramide-3,polyglyceryl-10-oleate,hydrogenated-lecithin,glycosphingolipids,carbomer,potassium-hydroxide,fragrance,methylparaben,disodium-edta,alpha-isomethyl-ionone,benzyl-salicylate,butylphenyl-methylpropional,citronellol,coumarin,geraniol,hexyl-cinnamal,hydroxycitronellal,hydroxyisohexyl-3-cyclohexene-carboxaldehyde,limonene,linalool",neutral,lightweight-lotion,all,"lightweight,hydrating,brightening,barrier-repair",both,daily,"The Face Shop Rice & Ceramide Moisture Emulsion is a lightweight Korean moisturizer formulated to brighten dull skin, soften rough patches, and deeply hydrate without heaviness. Powered by rice extract and skin-strengthening ceramide, this fast-absorbing emulsion locks in moisture for up to 12 hours while improving texture and reducing the look of dark spots, freckles, and uneven tone.","Strengthens skin barrier, brightens dark spots, provides long-lasting hydration, lightweight finish.",Apply after toner/serum. Pat gently into the skin for better absorption.,4.6,41501959847971,7176836907043
TONERS,The Face Shop,Rice & Ceramide Moisturizing Toner,TRUE,Hydrating Toner,? 899,150 ml,"dry,normal",TRUE,"dryness,dullness,large-pores","rice-extract,ceramide-np,rice-bran-oil","water/eau,glycerin,alcohol-denat,glycereth-26,dipropylene-glycol,peg-75,1,2-hexanediol,oryza-sativa-(rice)-extract,oryza-sativa-(rice)-bran-oil,ceramide-np,dimethicone,peg-60-hydrogenated-castor-oil,hydrogenated-lecithin,acrylates/c10-30-alkyl-acrylate-crosspolymer,sodium-hyaluronate,caprylic/capric-triglyceride,polyglyceryl-10-oleate,lecithin,glycosphingolipids,potassium-hydroxide,trisodium-edta,phenoxyethanol,ethylhexylglycerin,parfum/fragrance",neutral,viscous-liquid,all,"hydrating,pH-balancing,brightening,pore-care",both,daily,"The Face Shop Rice & Ceramide Moisturizing Toner is a hydrating, skin-softening toner made to replenish moisture, smooth rough patches, and keep your barrier strong from the very first step. With its creamy-milky, lightweight texture, it sinks into the skin instantly leaving your face fresh, plump, and ready for the next skincare step.","Hydrates and softens skin, minimizes pores, brightens skin tone, strengthens barrier.",Pour onto a cotton pad or palms and sweep over the face.,4.8,41501959880739,7176836939811
MOISTURIZERS,House of Dohwa,Rice Bran Moisturizer,TRUE,Moisturizer,"? 1,950",50 ml,"dry,normal,sensitive",TRUE,"dryness,dullness,texture","rice-bran-extract,shea-butter,limnanthes-alba-seed-oil","aqua,dibutyl-adipate,propanediol,alcohol,butyloctyl-salicylate,ethylhexyl-triazone,terephthalylidene-dicamphor-sulfonic-acid,polyglyceryl-3-distearate,niacinamide,tromethamine,caprylyl-methicone,1,2-hexanediol,pentylene-glycol,polymethylsilsesquioxane,polysilicone-15,diethylamino-hydroxybenzoyl-hexyl-benzoate,dimethicone/vinyl-dimethicone-crosspolymer,cetearyl-alcohol,vp/eicosene-copolymer,glyceryl-stearate,potassium-cetyl-phosphate,bisethylhexyloxyphenol-methoxyphenyl-triazine,methylpropanediol,carbomer,parfum,ammonium-acryloyldimethyltaurate/vp-copolymer,acrylates/c10-30-alkyl-acrylate-crosspolymer,glyceryl-stearate-citrate,silica,butylene-glycol,ethylhexylglycerin,adenosine,polyether-1,biosaccharide-gum-1,tocopherol,oryza-sativa-(rice)-extract,oryza-sativa-(rice)-bran-extract,bellis-perennis-(daisy)-flower-extract,portulaca-oleracea-extract,houttuynia-cordata-extract,centella-asiatica-extract,phenethyl-alcohol,caprylyl-glycol,sodium-chloride,disodium-phosphate,potassium-phosphate,potassium-chloride",neutral,cream,cold-dry,"nourishing,fragrance-free,soothing,softening",both,daily,"The House of Dohwa Rice Bran Facial Moisturizer is a deeply hydrating, hypoallergenic Korean cream formulated to soothe sensitive skin, moisturize dry patches, and restore a healthy glow. Made with freshly harvested Korean rice bran extract, this lightweight, non-sticky cream absorbs fast and delivers long-lasting comfort—perfect for daily use in humid or dry climates.

It keeps your barrier strong, your skin soft, and your complexion naturally radiant.","Deeply nourishes, strengthens barrier, smoothes rough texture, provides long-lasting hydration.",Apply to face and neck after serum. Massage gently for better absorption.,4.5,41501959913507,7176836972579
MOISTURIZERS,House of Dohwa,Rice Bran Moisturizer (Mini),TRUE,Moisturizer,? 750,10 ml,"dry,normal,sensitive",TRUE,"dryness,dullness","rice-bran-extract,shea-butter","aqua,dibutyl-adipate,propanediol,alcohol,butyloctyl-salicylate,ethylhexyl-triazone,terephthalylidene-dicamphor-sulfonic-acid,polyglyceryl-3-distearate,niacinamide,tromethamine,caprylyl-methicone,1,2-hexanediol,pentylene-glycol,polymethylsilsesquioxane,polysilicone-15,diethylamino-hydroxybenzoyl-hexyl-benzoate,dimethicone/vinyl-dimethicone-crosspolymer,cetearyl-alcohol,vp/eicosene-copolymer,glyceryl-stearate,potassium-cetyl-phosphate,bisethylhexyloxyphenol-methoxyphenyl-triazine,methylpropanediol,carbomer,parfum,ammonium-acryloyldimethyltaurate/vp-copolymer,acrylates/c10-30-alkyl-acrylate-crosspolymer,glyceryl-stearate-citrate,silica,butylene-glycol,ethylhexylglycerin,adenosine,polyether-1,biosaccharide-gum-1,tocopherol,oryza-sativa-(rice)-extract,oryza-sativa-(rice)-bran-extract,bellis-perennis-(daisy)-flower-extract,portulaca-oleracea-extract,houttuynia-cordata-extract,centella-asiatica-extract,phenethyl-alcohol,caprylyl-glycol,sodium-chloride,disodium-phosphate,potassium-phosphate,potassium-chloride",neutral,cream,cold-dry,"travel-size,nourishing,fragrance-free",both,daily,"This lightweight, hypoallergenic moisturizer delivers deep hydration while soothing redness and restoring comfort. Made with freshly harvested Korean rice bran extract, it absorbs quickly without heaviness — leaving your skin soft, smooth, and naturally radiant.

Perfect for travel, trial use, or daily moisture on the go.","Deeply nourishes, strengthens barrier, travel-friendly.",Apply to face and neck after serum.,4.5,41501959716899,7176836808739
MASKS & PEELS,House of Dohwa,Rice Bran Sheet Mask,TRUE,Sheet Mask,? 200,25 ml,"dry,sensitive",TRUE,"dryness,dullness,redness","rice-bran-extract,cotton-sheet","water,dipropylene-glycol,glycerin,niacinamide,oryza-sativa-(rice)-extract,oryza-sativa-(rice)-bran-extract,houttuynia-cordata-extract,artemisia-vulgaris-extract,paeonia-lactiflora-root-extract,glycyrrhiza-glabra-(licorice)-root-extract,polygonum-multiflorum-root-extract,phellinus-linteus-extract,morus-alba-bark-extract,sophora-flavescens-root-extract,cimicifuga-racemosa-root-extract,sesamum-indicum-(sesame)-seed-extract,angelica-gigas-root-extract,scutellaria-baicalensis-root-extract,limnanthes-alba-(meadowfoam)-seed-oil,polyglyceryl-3-methylglucose-distearate,1,2-hexanediol,hydrogenated-lecithin,methyl-glucose-sesquistearate,cetearyl-glucoside,butylene-glycol,hydroxyacetophenone,caprylyl-glycol,dipotassium-glycyrrhizate,allantoin,betaine,adenosine,carbomer,tromethamine,polyglyceryl-10-laurate,ethylhexylglycerin,tocopherol,disodium-edta,fragrance",neutral,sheet,all,"biodegradable,soothing,hydrating",evening,weekly,"The House of Dohwa Rice Bran Sheet Mask delivers a skin-drenching dose of nourishment using rice bran grown in Korea’s pristine local farms, where traditional cultivation methods ensure richer nutrients and higher purity. Each cotton sheet hugs the skin comfortably while delivering deep hydration, soothing benefits, and a natural glow — all powered by freshly milled rice bran extract.","Instant hydration, calms redness, softens skin, biodegradable sheet.",Apply to clean face after toning. Leave for 10-20 mins. Pat remaining essence into skin.,4.7,41501959749667,7176836808739
SUNSCREENS,House of Dohwa,Rice Bran Sunscreen SPF50+ PA++++,TRUE,Chemical Sunscreen,"? 1,650",50 ml,"dry,normal,sensitive",TRUE,"dryness,dullness,sun-protection","rice-bran-extract,niacinamide,daisy-flower-extract","aqua,dibutyl-adipate,propanediol,alcohol,butyloctyl-salicylate,ethylhexyl-triazone,terephthalylidene-dicamphor-sulfonic-acid,polyglyceryl-3-distearate,niacinamide,tromethamine,caprylyl-methicone,1,2-hexanediol,pentylene-glycol,polymethylsilsesquioxane,polysilicone-15,diethylamino-hydroxybenzoyl-hexyl-benzoate,dimethicone/vinyl-dimethicone-crosspolymer,cetearyl-alcohol,vp/eicosene-copolymer,glyceryl-stearate,potassium-cetyl-phosphate,bisethylhexyloxyphenol-methoxyphenyl-triazine,methylpropanediol,carbomer,parfum,ammonium-acryloyldimethyltaurate/vp-copolymer,acrylates/c10-30-alkyl-acrylate-crosspolymer,glyceryl-stearate-citrate,silica,butylene-glycol,ethylhexylglycerin,adenosine,polyether-1,biosaccharide-gum-1,tocopherol,oryza-sativa-(rice)-extract,oryza-sativa-(rice)-bran-extract,bellis-perennis-(daisy)-flower-extract,portulaca-oleracea-extract,houttuynia-cordata-extract,centella-asiatica-extract,phenethyl-alcohol,caprylyl-glycol,sodium-chloride,disodium-phosphate,potassium-phosphate,potassium-chloride",neutral,lotion,all,"no-white-cast,hydrating,vegan,glow-finish",morning,daily,"House Of Dohwa Rice Bran Sunscreen is a gentle daily SPF that blends lightweight hydration with powerful broad-spectrum protection. Infused with locally sourced Korean rice bran extract, this sunscreen shields your skin from UVA/UVB rays while nourishing it with vitamins, antioxidants, and moisture — leaving your skin bright, smooth, and comfortably hydrated all day. Perfect for dry, sensitive, dull, or easily irritated skin types that want protection without white cast, heaviness, or pilling.
","High sun protection, brightens dull skin, moisturizes like a cream, leaves a dewy glow.",Apply generously as the last step of your morning routine 15 minutes before sun exposure.,4.6,41501959782435,7176836841507
CLEANSERS,The Face Shop,Rice Water Bright Cleansing Foam,TRUE,Foam Cleanser,? 625,100 ml,"combination,normal,oily",FALSE,"dullness,pigmentation,texture","rice-water-extract,soapwort-extract,moringa-oil","water/eau,myristic-acid,glycerin,potassium-hydroxide,stearic-acid,glycol-distearate,lauric-acid,cocamidopropyl-betaine,cocamide-mea,sodium-chloride,disodium-cocoamphodiacetate,glyceryl-stearate,peg-100-stearate,sodium-lauryl-sulfate,hexylene-glycol,titanium-dioxide-(ci-77891),divinyl-dimethicone/dimethicone-copolymer,disodium-edta,hydroxypropyl-methylcellulose,c12-13-alketh-23,c12-13-alketh-3,butylene-glycol,1,2-hexanediol,oryza-sativa-(rice)-bran-oil,oryza-sativa-(rice)-extract,saponaria-officinalis-leaf-extract,sodium-benzoate,phenoxyethanol,yellow-5-(ci-19140),red-4-(ci-14700),blue-1-(ci-42090),parfum/fragrance,hexyl-cinnamal",neutral,creamy-foam,all,"brightening,deep-cleansing,hydrating,softening",both,daily,"A lightweight, creamy foaming wash that cleans deeply yet remains gentle—built around the classic Korean rice water ritual. This 100 ml tube is made for everyday use when you want a clearer, brighter look without stripping your skin.","Brightens skin tone, deep cleanses pores, moisturizes while cleansing, improves texture.",Lather a small amount with water and massage onto face. Rinse thoroughly with lukewarm water.,4.5,41501959815203,7176836874275
CLEANSERS,The Face Shop,Rice Water Bright Light Cleansing Oil,TRUE,Oil Cleanser,? 594,55 ml,"combination,normal,oily",FALSE,"blackheads,oiliness,pores","rice-bran-oil,jojoba-seed-oil","isopropyl-myristate,caprylic/capric-triglyceride,sorbeth-30-tetraoleate,polyglyceryl-10-diisostearate,oryza-sativa-(rice)-bran-oil,simmondsia-chinensis-(jojoba)-seed-oil,water/eau,glycerin,oryza-sativa-(rice)-extract,saponaria-officinalis-leaf-extract,perfume/fragrance",neutral,lightweight-oil,all,"double-cleansing,pore-care,non-greasy,makeup-removal",evening,daily,"The Rice Water Bright Light Cleansing Oil is a lightweight yet powerful cleansing oil designed to melt away sunscreen, makeup, excess oil, and impurities without leaving any greasy residue behind. Enriched with brightening rice water and purifying plant oils, it leaves your skin soft, fresh, and radiant after every cleanse.","Dissolves waterproof makeup, clears blackheads, brightens skin, lightweight formula.",Pump oil onto dry hands and massage onto dry face. Emulsify with water and rinse off.,4.7,41501959946275,7176837005347
CLEANSERS,COSRX,Salicylic Acid Daily Gentle Cleanser,TRUE,Foam Cleanser,? 850,150 ml,oily,FALSE,"acne,blackheads,oiliness","salicylic-acid,tea-tree-oil,willow-bark-water","water,glycerin,myristic-acid,stearic-acid,potassium-hydroxide,lauric-acid,butylene-glycol,glycol-distearate,polysorbate-80,salix-alba-bark-water,sodium-methyl-cocoyl-taurate,cocamidopropyl-betaine,peg-60-hydrogenated-castor-oil,salicylic-acid,limonene,citrus-limon-peel-oil,citric-acid,melaleuca-alternifolia-leaf-oil,sodium-chloride,disodium-edta,1-2-hexanediol,ethyl-hexanediol,caprylyl-glycol,ethylhexylglycerin",neutral,creamy-foam,all,"acne-fighting,deep-cleansing,oil-control,exfoliating",both,daily,"The COSRX Salicylic Acid Daily Gentle Cleanser is a powerful, yet gentle foaming face wash designed to deep-clean pores, control excess oil, and fight acne without stripping your skin. Infused with 0.5% Salicylic Acid, this daily cleanser exfoliates away dead skin cells, unclogs pores, and prevents breakouts—all while maintaining your skin’s natural moisture balance.","Fights acne, controls oil, unclogs pores, exfoliates dead skin cells.","Dispense a small amount, lather with water, and massage onto face. Rinse off.",4.8,41501959979043,7176837038115
