CATEGORY,BRAND,NAME,INSTOCK,SUBCATEGORY,MRP,WEIGHT,SKINTYPES,SENSITIVITYSAFE,CONCERNADDRESSED,KEYINGREDIENTS,FULLINGREDIENTLIST,GENDER,TEXTURE,CLIMATESUITABILITY,PREFERENCES,USAGE,FREQUENCY,DESCRIPTION,BENEFITS,INSTRUCTIONS,RATING, SHOPIFYVARIANTID,SHOPIFYPRODCUTID
SERUMS & AMPOULES,SKIN1004,Madagascar Centella Probio-Cica Intensive Ampoule,TRUE,Repair Serum,"? 2,050",50 ml,"dry,sensitive",TRUE,"aging,dryness,sensitivity","centella-asiatica-extract,probio-cica,ceramide-np,panthenol","centella-asiatica-extract,butylene-glycol,glycerin,water,propanediol,caprylic/capric-triglyceride,niacinamide,lactobacillus/centella-asiatica-extract-ferment-filtrate,1,2-hexanediol,dipropylene-glycol,polyglyceryl-3-distearate,acrylates/c10-30-alkyl-acrylate-crosspolymer,c14-22-alcohols,arginine,hydrogenated-lecithin,betaine,allantoin,panthenol,hydroxystearic-acid,ethylhexylglycerin,hydroxyethyl-acrylate/sodium-acryloyldimethyl-taurate-copolymer,glyceryl-stearate-citrate,sodium-polyacrylate,adenosine,c12-20-alkyl-glucoside,cetearyl-alcohol,xanthan-gum,macadamia-ternifolia-seed-oil,sodium-phytate,sodium-hyaluronate,stearic-acid,ceramide-np,glyceryl-acrylate/acrylic-acid-copolymer,sorbitan-isostearate,polyglyceryl-10-myristate,madecassic-acid,asiaticoside,phytosphingosine,asiatic-acid,sucrose-distearate,polyglutamic-acid,glucose,lauric-acid,phytosterols",neutral,rich-fluid,cold-dry,"barrier-repair,fermented,anti-aging,nourishing",both,daily,"Give your skin a serious reset with the Madagascar Centella Probio-Cica Intensive Ampoule — your go-to solution for deep repair, barrier care, and long-lasting hydration. Powered by SKIN1004’s exclusive Probio-Cica complex and fermented Centella Asiatica, this ampoule calms irritated skin, strengthens a weakened moisture barrier, and supports long-term skin resilience.
","Repairs damaged barrier, deeply nourishes, improves skin texture, soothes irritation.",Apply a few drops to the face and massage gently. Follow with moisturizer.,4.6,41501957488675,7176834777123
TONERS,SKIN1004,Madagascar Centella Tone Brightening Boosting Toner,TRUE,Brightening Toner,"? 1,699",210 ml,sensitive,TRUE,"dullness,pigmentation,uneven-skin-tone","centella-asiatica-extract,niacinamide,3-o-ethyl-ascorbic-acid,madecassoside","water,1,2-hexanediol,niacinamide,pentylene-glycol,butylene-glycol,glycerin,propanediol,centella-asiatica-extract,xanthan-gum,panthenol,allantoin,betaine,ethylhexylglycerin,xylitylglucoside,anhydroxylitol,disodium-edta,xylitol,madecassoside,glucose,carica-papaya-(papaya)-fruit-extract,pyrus-malus-(apple)-fruit-extract,prunus-mume-fruit-extract,vitis-vinifera-(grape)-fruit-extract,3-o-ethyl-ascorbic-acid,caprylic/capric-triglyceride",neutral,watery,all,"brightening,soothing,vitamin-c,fast-absorbing",morning,daily,"The SKIN1004 Madagascar Centella Tone Brightening Boosting Toner (210ml) is the ultimate glow-giver for tired, uneven, and sensitive skin. If your skin looks dull or feels rough, this toner brings it back to life. It gently exfoliates, deeply hydrates, and evens out skin tone without any stinging or stickiness. With every use, your skin feels softer, smoother, and looks visibly brighter. Perfect for anyone who wants that fresh, clean-skin look—without using too many products. Simple. Lightweight. And designed to make your skin actually glow.
","Boosts radiance, reduces irritation, prepares skin for serum, hydrates instantly.",Apply to clean face using hands or a cotton pad. Pat gently to absorb.,4.4,41501957521443,7176834809891
SERUMS & AMPOULES,SKIN1004,Madagascar Centella Tone Brightening Capsule Ampoule,TRUE,Brightening Serum,"? 2,450",100 ml,,TRUE,"pigmentation,redness","centella-asiatica-extract,niacinamide,tranexamic-acid,madewhite","water,butylene-glycol,niacinamide,glycerin,tranexamic-acid,1,2-hexanediol,betaine,centella-asiatica-extract,zea-mays-(corn)-starch,xanthan-gum,microcrystalline-cellulose,mannitol,panthenol,pentylene-glycol,ethylhexylglycerin,hydroxyethylcellulose,madecassoside,acrylates/c10-30-alkyl-acrylate-crosspolymer,arginine,hydrogenated-lecithin,xylitylglucoside,anhydroxylitol,xylitol,glucose,3-o-ethyl-ascorbic-acid,lactobacillus-ferment",neutral,lightweight-with-capsules,all,"brightening,soothing,large-size,non-sticky",both,daily,"The SKIN1004 Madagascar Centella Tone Brightening Capsule Ampoule (100ml) is a mid-weight ampoule designed to visibly brighten skin tone and fade discoloration. With melting Madewhite™ capsules, 4% Niacinamide, and 2% Tranexamic Acid, it helps reduce dark spots and dullness while locking in moisture. The oil-in-water gel formula absorbs fast, so your skin feels hydrated, soothed, and smooth—never greasy or heavy.
","Fades dark spots, calms redness, evens skin tone, hydrates without greasiness.",Drop an appropriate amount and massage into skin until capsules dissolve.,4.7,41501957554211,7176834842659
SERUMS & AMPOULES,SKIN1004,Madagascar Centella Tone Brightening Capsule Ampoule (Mini),TRUE,Brightening Serum,? 999,30 ml,,TRUE,"pigmentation,redness","centella-asiatica-extract,niacinamide,tranexamic-acid,madewhite","water,butylene-glycol,niacinamide,glycerin,tranexamic-acid,1,2-hexanediol,betaine,centella-asiatica-extract,zea-mays-(corn)-starch,xanthan-gum,microcrystalline-cellulose,mannitol,panthenol,pentylene-glycol,ethylhexylglycerin,hydroxyethylcellulose,madecassoside,acrylates/c10-30-alkyl-acrylate-crosspolymer,arginine,hydrogenated-lecithin,xylitylglucoside,anhydroxylitol,xylitol,glucose,3-o-ethyl-ascorbic-acid,lactobacillus-ferment",neutral,lightweight-with-capsules,all,"travel-size,brightening,soothing,non-sticky",both,daily,"The SKIN1004 Madagascar Centella Tone Brightening Capsule Ampoule (100ml) is a mid-weight ampoule designed to visibly brighten skin tone and fade discoloration. With melting Madewhite™ capsules, 4% Niacinamide, and 2% Tranexamic Acid, it helps reduce dark spots and dullness while locking in moisture. The oil-in-water gel formula absorbs fast, so your skin feels hydrated, soothed, and smooth—never greasy or heavy.
","Fades dark spots, calms redness, evens skin tone, hydrates without greasiness.",Drop an appropriate amount and massage into skin until capsules dissolve.,4.7,41501957586979,7176834875427
MOISTURIZERS,SKIN1004,Madagascar Centella Tone Brightening Capsule Cream,TRUE,Face Cream,"? 2,050",75 ml,"dry,sensitive",TRUE,"dark-spots,dullness,pigmentation","centella-asiatica-extract,niacinamide,tranexamic-acid,shea-butter","water,butylene-glycol,propanediol,niacinamide,isotridecyl-isononanoate,phenyl-trimethicone,1,2-hexanediol,tranexamic-acid,diglycerin,centella-asiatica-extract,butyrospermum-parkii-(shea)-butter,squalane,polyglyceryl-3-distearate,xylitylglucoside,cetyl-alcohol,acrylates/c10-30-alkyl-acrylate-crosspolymer,anhydroxylitol,polyacrylate-crosspolymer-6,arginine,trehalose,zea-mays-(corn)-starch,xylitol,panthenol,pentylene-glycol,microcrystalline-cellulose,mannitol,glyceryl-stearate-citrate,hydroxyethyl-urea,ethylhexylglycerin,glycerin,glucose,madecassoside,sodium-hyaluronate,bisabolol,hydrogenated-lecithin,glyceryl-acrylate/acrylic-acid-copolymer,pyrus-communis-(pear)-flower-extract,lactobacillus-ferment",neutral,gel-cream-with-capsules,all,"brightening,soothing,hydrating,fragrance-free",morning,daily,"The SKIN1004 Madagascar Centella Tone Brightening Capsule Cream (75ml) is more than just hydration—it’s daily skincare that helps visibly correct dark spots and even out tone. With Madewhite™ capsules, Niacinamide, and Tranexamic Acid, this cream works deep to reduce dullness and restore glow. Its light, gel-cream texture absorbs fast and leaves skin soft, calm, and naturally radiant—without greasiness or irritation.
","Brightens dull skin, fades dark spots, soothes irritation, deeply hydrates without stickiness.",Apply a generous amount to face and massage gently until the capsules melt and absorb.,4.5,41501957619747,7176834875427
SUNSCREENS,SKIN1004,Madagascar Centella Tone Brightening Tone-Up Sunscreen SPF50+ PA++++,TRUE,Hybrid Sunscreen,"? 2,099",50 ml,normal,TRUE,"dullness,sun-protection,uneven-skin-tone","centella-asiatica-extract,tranexamic-acid,niacinamide,titanium-dioxide","aqua(water),dibutyl-adipate,titanium-dioxide,propanediol,caprylic/capric-triglyceride,centella-asiatica-extract(29,400ppm),c12-15-alkyl-benzoate,diethylamino-hydroxybenzoyl-hexyl-benzoate,ethylhexyl-triazone,niacinamide,caprylyl-methicone,diethylhexyl-butamido-triazone,1,2-hexanediol,pentylene-glycol,corchorus-olitorius-leaf-extract,hordeum-vulgare-extract,nymphaea-alba-flower-extract,sodium-hyaluronate,coco-caprylate/caprate,glycerin,polyhydroxystearic-acid,dimethicone/vinyl-dimethicone-crosspolymer,vp/eicosene-copolymer,dimethiconol,trisiloxane,stearic-acid,alumina,sodium-polyacryloyldimethyl-taurate,polyacrylate-crosspolymer-6,hydroxypropyl-methylcellulose-stearoxy-ether,dicaprylyl-carbonate,ethylhexylglycerin,xanthan-gum,triethoxycaprylylsilane,adenosine,sodium-polyacrylate,madecassoside,pvm/ma-copolymer,polyether-1,t-butyl-alcohol,tranexamic-acid,dipropylene-glycol,sodium-palmitoyl-proline,butylene-glycol,iron-oxides(ci-77492),iron-oxides(ci-77491)",neutral,cream,all,"tone-up,brightening,color-correcting,peach-tint",morning,daily,"The SKIN1004 Madagascar Centella Tone Brightening Tone-Up Sunscreen (50ml) is more than just sun protection—it’s your daily skin-perfecting shield. With a soft tone-up tint, it instantly evens out dull or tired-looking skin while offering SPF 50+ PA++++ protection. Powered by Tranexamic Acid, it helps fade dark spots over time and adds a natural glow, not a grey cast. Ideal for days when you want a fresh, bright look without wearing foundation. Lightweight, non-greasy, and perfect for sensitive skin that needs both care and coverage.
","High sun protection, instantly brightens complexion, corrects yellow undertones, hydrates.",Apply evenly to face as the last step of skincare. Can be used as a makeup base.,4.4,41501957652515,7176834908195
TONERS,By Wishtrend,Mandelic Acid 5% Skin Prep Water,TRUE,Exfoliating Toner,"? 1,800",120 ml,sensitive,FALSE,"acne,texture,whiteheads","mandelic-acid,beta-glucan,panthenol,centella-asiatica","water,mandelic-acid,butylene-glycol,beta-glucan,panthenol,glycyrrhiza-glabra-root-extract,prunus-amygdalus-dulcis-fruit-extract,sodium-hyaluronate,sorbitan-sesquioleate,centella-asiatica-extract,houttuynia-cordata-extract,sorbitol,dimethyl-sulfone,chlorphenesin,sodium-citrate,arginine,peg-60-hydrogenated-castor-oil,ethylhexylglycerin,natto-gum,carbomer",neutral,watery,all,"gentle-exfoliation,acne-care,texture-smoothing,low-irritation",evening,2-3-times-a-week,"andelic acid is an alpha hydroxyl acid derived from bitter almonds but is less irritating to the skin compared to Glycolic acid. Mandelic acid has a larger molecular weight that sits on the surface of the skin and gently exfoliates without irritating the skin. Mandelic acid helps to exfoliate dead skin cells and promotes skin cell turnover, lightens blemishes and dark spots, fights skin ageing and results in brighter, even toned and healthier, radiant skin.

Additional key ingredients like Panthenol, Centella Asiatica Extract and Beta-Glucan soothes and moisturizes the skin even after exfoliation. Best suited for all skin types, especially sensitive skin.","Exfoliates gently, clears acne/whiteheads, smooths texture, brightens tone.",Apply to a cotton pad and wipe face after cleansing. Follow with moisturizer.,4.5,41501957685283,7176834940963
TONERS,By Wishtrend,Mandelic Acid 5% Skin Prep Water 30ml,TRUE,Exfoliating Toner,? 650,30 ml,sensitive,FALSE,"acne,texture,whiteheads","mandelic-acid,beta-glucan,panthenol","water,mandelic-acid,butylene-glycol,beta-glucan,panthenol,glycyrrhiza-glabra-root-extract,prunus-amygdalus-dulcis-fruit-extract,sodium-hyaluronate,sorbitan-sesquioleate,centella-asiatica-extract,houttuynia-cordata-extract,sorbitol,dimethyl-sulfone,chlorphenesin,sodium-citrate,arginine,peg-60-hydrogenated-castor-oil,ethylhexylglycerin,natto-gum,carbomer",neutral,watery,all,"travel-size,gentle-exfoliation,acne-care",evening,2-3-times-a-week,"Mandelic acid is an alpha hydroxyl acid derived from bitter almonds but is less irritating to the skin compared to Glycolic acid. Mandelic acid has a larger molecular weight that sits on the surface of the skin and gently exfoliates without irritating the skin. Mandelic acid helps to exfoliate dead skin cells and promotes skin cell turnover, lightens blemishes and dark spots, fights skin ageing and results in brighter, even-toned and healthier, radiant skin.

Additional key ingredients like Panthenol, Centella Asiatica Extract and Beta-Glucan soothes and moisturizes the skin even after exfoliation.

Best suited for all skin types, especially sensitive skin.","Exfoliates gently, clears acne/whiteheads, smooths texture, portable.",Apply to a cotton pad and wipe face after cleansing. Follow with moisturizer.,4.5,41501957718051,7176834973731
MASKS & PEELS,JM Solution,Marine Luminous Pearl Whitening Mask (Premium),TRUE,Sheet Mask,? 250,30 ml,,TRUE,"dehydration,dullness,pigmentation","pearl-extract,sea-water,triple-hyaluronic-acid","water,butylene-glycol,niacinamide,trehalose,pearl-extract(1,010pm),dipotassium-glycyrrhizate,hydrolyzed-conchi-olin-protein(20.2pm),allantoin,arbutin,betaine,sea-water(9.7-ppm),arginine,glycerin,codium-fragile-extract,enteromorpha-compressa-extract,laminaria-japonica-extract,salicornia-her-bacea-extract,undaria-pinnatifida-extract,sodium-hyaluronate,hydrolyzed-hyaluronic-acid,sodium-acetylated-hyaluronate,carbomer,polyglyceryl-10-laurate,hydroxyethylcellulose,xan-than-gum,isopentyldiol,dipropylene-glycol,1,2-hexanediol,hyd-roxyacetophenone,methylpropanediol,ethylhexylglycerin,dis-odium-edta,fragrance",neutral,sheet,all,"brightening,luminous-finish,hydrating",evening,weekly,"A premium mask enriched with deep ocean water and pearl extract. It transforms dull skin into luminous, pearly skin while providing deep moisture.","Delivers intense hydration, brightens skin tone, creates a luminous glow, evens texture.",Apply mask to face. Leave for 15-20 mins. Pat essence.,4.7,41501957750819,7176834973731
TREATMENTS,Cathy Doll,Melon Sherbet Vitamin A Body Scrub,TRUE,Body Scrub,? 799,320 g,dry,FALSE,"aging,loss-of-elasticity,texture","vitamin-a,melon-extract,bee-venom,centella-asiatica","sodium-chloride,water,sodium-laureth-sulfate,cocamidopropyl-betaine,juglans-regia-(walnut)-shell-powder-prunus-amygdalus-dulcis-(sweet-almond)-shell-powder,parfum-xanthan-gum,guar-hydroxypropyltrimonium-chloride,retinol-sodium-benzoate,methylparaben,bee-venom-extract-centella-asiatica-leaf-extract,cucumis-melo-(melon)-extract,macinamide,tocopherol,magnesium-nitrate,propylene-glicol-methylchloroisothiazolinone,magnesium-chloride,hamanels-ignana-(witch-hazel)-bark/leaf-extract,methylisothazonce-4/19140,ci-42090",neutral,sherbet-scrub,all,"exfoliating,firming,cooling,smoothing",evening,2-3-times-a-week,"Cathy Doll Melon Sherbet Vitamin A Body Scrub is the ultimate solution for anyone struggling with rough texture or a lack of radiance. Designed to firm, exfoliate, and deeply nourish, it smooths away dullness while restoring elasticity for glowing skin. With its refreshing melon scent and skin-loving actives, it transforms your shower into a self-care ritual, leaving you with even skin tone, hydration, and a visibly firmer finish that moisturizes from within.","Exfoliates dead skin, firms and tightens, improves texture, cools and refreshes.","Massage onto damp skin in circular motions, focusing on rough areas. Rinse off with water.",4.5,41501957783587,7176835006499
MOISTURIZERS,Cathy Doll,Merry Go Round Perfume Lotion,TRUE,Body Lotion,? 999,150 ml,,FALSE,"dryness,dullness","niacinamide,vitamin-e,shea-butter,arbutin","aqua,fragrance,cetearyl-alcohol,glyceryl-stearate,mineral-oil,peg-100-stearate,allantoin,phenoxyethanol,dimethicone,carbomer,triethanolamine,polyacrylamide,methylparaben,c13-14-isoparaffin,propylparaben,xanthan-gum,laureth-7,alpha-arbutin,ascorbic-acid,púnica-granatum-seed-oil,tocopherol,ci-16035",female,lotion,all,"seductive-scent,fragrance-rich,softening,hydrating",both,daily,"Cathy Doll Merry Go Round Perfume Lotion is designed to moisturize, brighten, and reveal glowing skin. It keeps your skin soft and hydrated while wrapping it in an evening-embrace inspired scent that lingers beautifully. With notes of jasmine, rose, and warm musk, it captures the elegance of night, while leaving skin radiant, smooth, and unforgettable. With every use, skin looks healthier, smoother, and naturally luminous.","Intense fragrance, brightens skin, softens texture, long-lasting scent.",Apply evenly to the body.,4.6,41501957816355,7176835039267
MOISTURIZERS,"Dear, Klairs",Midnight Blue Calming Cream 30ml,TRUE,Calming Cream,"? 1,670",30 ml,"oily,sensitive",TRUE,"redness,sensitivity","guaiazulene,centella-asiatica-extract,ceramide-np","water,cetyl-ethylhexanoate,glycerin,butylene-glycol,caprylic/capric-triglyceride,centella-asiatica-extract,sorbitan-stearate,cetyl-alcohol,butyrospermum-parkii-butter,argania-spinosa-kernel-oil,simmondsia-chinensis-seed-oil,sorbitan-sesquioleate,glyceryl-stearate,stearic-acid,portulaca-oleracea-extract,anthemis-nobilis-flower-extract,candelilla-cera,chlorphenesin,polysorbate-60,1-2-hexanediol,xanthan-gum,tocopheryl-acetate,hydrogenated-lecithin,acrylates/c10-30-alkyl-acrylate-crosspolymer,tromethamine,brassica-oleracea-italica-extract,morus-alba-root-extract,guaiazulene,ceramide-np,sodium-hyaluronate,arachidic-acid,palmitic-acid,oleic-acid,lecithin,acetyl-glutamine,bacillus/folic-acid/soybean-ferment-extract,sh-oligopeptide-1,sh-oligopeptide-2,sh-polypeptide-1,sh-polypeptide-11,sh-polypeptide-9,caprylyl-glycol,acetyl-hexapeptide-8",neutral,blue-cream,all,"cooling,soothing,barrier-repair,travel-size",evening,daily,"The Dear Klairs Midnight Blue Calming Cream is expertly crafted with a soothing blend of centella asiatica extract and guaiazulene to calm and alleviate irritated or inflamed skin. Ideal for all skin types, especially those prone to sensitivity or redness, this cream provides gentle yet effective relief while promoting skin healing and recovery.","Calms redness instantly, soothes sunburns, hydrates sensitive skin, repairs barrier.",Apply a small amount to areas of sensitivity or irritation. Gently tap to absorb.,4.6,41501957849123,7176835072035
MOISTURIZERS,"Dear, Klairs",Midnight Blue Calming Cream 60ml,TRUE,Calming Cream,"? 2,100",60 ml,"oily,sensitive",TRUE,"redness,sensitivity","guaiazulene,centella-asiatica-extract,ceramide-np","water,cetyl-ethylhexanoate,glycerin,butylene-glycol,caprylic/capric-triglyceride,centella-asiatica-extract,sorbitan-stearate,cetyl-alcohol,butyrospermum-parkii-butter,argania-spinosa-kernel-oil,simmondsia-chinensis-seed-oil,sorbitan-sesquioleate,glyceryl-stearate,stearic-acid,portulaca-oleracea-extract,anthemis-nobilis-flower-extract,candelilla-cera,chlorphenesin,polysorbate-60,1-2-hexanediol,xanthan-gum,tocopheryl-acetate,hydrogenated-lecithin,acrylates/c10-30-alkyl-acrylate-crosspolymer,tromethamine,brassica-oleracea-italica-extract,morus-alba-root-extract,guaiazulene,ceramide-np,sodium-hyaluronate,arachidic-acid,palmitic-acid,oleic-acid,lecithin,acetyl-glutamine,bacillus/folic-acid/soybean-ferment-extract,sh-oligopeptide-1,sh-oligopeptide-2,sh-polypeptide-1,sh-polypeptide-11,sh-polypeptide-9,caprylyl-glycol,acetyl-hexapeptide-8",neutral,blue-cream,all,"cooling,soothing,barrier-repair,spot-treatment",evening,daily,"The Dear Klairs Midnight Blue Calming Cream is expertly crafted with a soothing blend of centella asiatica extract and guaiazulene to calm and alleviate irritated or inflamed skin. Ideal for all skin types, especially those prone to sensitivity or redness, this cream provides gentle yet effective relief while promoting skin healing and recovery.","Calms redness instantly, soothes sunburns, hydrates sensitive skin, repairs barrier.",Apply a small amount to areas of sensitivity or irritation. Gently tap to absorb.,4.6,41501957881891,7176835104803
MASKS & PEELS,"Dear, Klairs",Midnight Blue Calming Sheet Mask,TRUE,Sheet Mask,? 200,25 ml,"oily,sensitive",TRUE,"oiliness,redness,sensitivity","willow-bark-extract,erythritol,centella-asiatica-extract,tea-tree-leaf-oil","water,butylene-glycol,methylpropanediol,glycereth-26,1-2-hexanediol,salix-alba-bark-extract,glycerin,erythritol,betaine,arginine,carbomer,allantoin,ethylhexylglycerin,polyglyceryl-10-laurate,propanediol,glyceryl-acrylate/acrylic-acid-copolymer,carrageenan,pvm/ma-copolymer,disodium-edta,dipotassium-glycyrrhizate,centella-asiatica-extract",neutral,charcoal-sheet,hot-humid,"cooling,pore-care,soothing,purifying",evening,as-needed,"Need some help cooling down? Choose the Klairs Midnight Blue Calming Sheet Mask to help you keep calm and relaxed. With its anti-inflammatory properties and ingredients specially designed to nurture your sensitive skin, the soft rayon sheet will provide comfort to the face and bamboo charcoal powder will help you cleanse pores and keep blackheads at bay!","Lowers skin temperature, calms irritation, cleanses pores, reduces redness.",Apply mask to face. Leave on for 15-20 minutes. Remove and pat essence into skin.,4.5,41501957914659,7176835104803
SUNSCREENS,Elizavecca,Milky Piggy SUN Great Block Stick SPF 50+ PA+++,TRUE,Sun Stick,"? 1,490",22 g,"combination,dry",TRUE,"dehydration,sun-protection,uneven-skin-tone","lavender-extract,chamomile-extract,mint-leaf-extract","octyldodecanol,dicaprylyl-carbonate,methyl-methacrylate-crosspolymer,ethylhexyl-methoxycinnamate,dibutyl-lauroyl-glutamide,caprylic/capric-triglyceride,octocrylene,homosalate,ethylhexyl-salicylate,dibutyl-ethylhexanoyl-glutamide,butyl-methoxydibenzoylmethane,tocopheryl-acetate,water,lavandula-angustifolia-(lavender)-flower-extract,mentha-rotundifolia-leaf-extract,melissa-officinalis-leaf-extract,rosmarinus-officinalis-(rosemary)-leaf-extract,chamomilla-recutita-(matricaria)-extract,monarda-didyma-leaf-extract,salvia-officinalis-(sage)-leaf-extract,mentha-piperita-(peppermint)-leaf-extract,rosa-centifolia-flower-extract",neutral,balm-stick,all,"portable,no-white-cast,soothing,herbal-extracts",morning,daily,"The Elizavecca – Milky Piggy SUN Great Block Stick SPF is a sunstick that protects your skin from the harmful ultraviolet rays of the sun that can potentially cause skin concerns such as uneven skin tone, enlarged pores, early aging, sunburn and dehydration.
","High sun protection, soothing herbal complex, convenient reapplication, no white cast.",Twist the dial to reveal the stick. Swipe generously over face and neck. Reapply every 2-3 hours.,4.3,41501957947427,7176835137571
MASKS & PEELS,House of Dohwa,Mung Bean Wash Off Mask,TRUE,Clay Mask,"? 1,450",100 ml,"combination,oily",TRUE,"acne,large-pores,oiliness","mung-bean-extract,kaolin,bentonite","aqua,propanediol,1,2-hexanediol,niacinamide,saccharomyces/rice-ferment-filtrate,sorbitan-sesquioleate,caprylic/capric-triglyceride,glycerin,polyglyceryl-3-methylglucose-distearate,butylene-glycol,arginine,carbomer,glyceryl-caprylate,galactomyces-ferment-filtrate,ammonium-acryloyldimethyltaurate/vp-copolymer,pentylene-glycol,panthenol,ethylhexylglycerin,hydrogenated-lecithin,adenosine,oryza-sativa-(rice)-bran-extract,malt-extract,ceramide-np,parfum,oryza-sativa-(rice)-extract",neutral,creamy-clay,hot-humid,"pore-care,cooling,vegan,cruelty-free",evening,weekly,"The House of Dohwa Mung Bean Wash Off Mask is a gentle Korean clay mask that helps unclog pores, control excess oil, calm breakouts, and smooth rough texture. Inspired by traditional Korean “Mung Bean therapy,” this soothing mask instantly cools overheated, irritated, or acne-prone skin — leaving it clearer, softer, and more balanced after every use.","Unclogs pores, controls oil, calms acne, cools skin temperature.","Apply a thick layer to clean, dry face. Leave on for 10 minutes and rinse with lukewarm water.",4.3,41501957980195,7176835170339
MASKS & PEELS,House of Dohwa,Mung Bean Wash Off Mask (Mini),TRUE,Clay Mask,? 350,10 ml,oily,TRUE,"acne,pores","mung-bean-extract,kaolin","aqua,propanediol,1,2-hexanediol,niacinamide,saccharomyces/rice-ferment-filtrate,sorbitan-sesquioleate,caprylic/capric-triglyceride,glycerin,polyglyceryl-3-methylglucose-distearate,butylene-glycol,arginine,carbomer,glyceryl-caprylate,galactomyces-ferment-filtrate,ammonium-acryloyldimethyltaurate/vp-copolymer,pentylene-glycol,panthenol,ethylhexylglycerin,hydrogenated-lecithin,adenosine,oryza-sativa-(rice)-bran-extract,malt-extract,ceramide-np,parfum,oryza-sativa-(rice)-extract",neutral,creamy-clay,hot-humid,"travel-size,pore-care,cooling",evening,weekly,"A travel-friendly mini of the bestselling Mung Bean Wash Off Mask — your weekly pore-purifying treatment inspired by traditional Korean “Mung Bean therapy.” This gentle clay mask helps unclog pores, absorb excess oil, calm acne flare-ups, and instantly cool overheated or irritated skin. Perfect for trying out the formula or keeping in your skincare pouch for on-the-go soothing care.","Unclogs pores, controls oil, travel-friendly.",Apply to T-zone or oily areas. Rinse after 10 mins.,4.3,41501958012963,7176835203107
