CATEGORY,BRAND,NAME,INSTOCK,SUBCATEGORY,MRP,WEIGHT,SKINTYPES,SENSITIVITYSAFE,CONCERNADDRESSED,KEYINGREDIENTS,FULLINGREDIENTLIST,GENDER,TEXTURE,CLIMATESUITABILITY,PREFERENCES,USAGE,FREQUENCY,DESCRIPTION,BENEFITS,INSTRUCTIONS,RATING, SHOPIFYVARIANTID,SHOPIFYPRODCUTID
MOISTURIZERS,Dr. Althea,345 Relief Cream,TRUE,Soothing Cream,"? 2,499",50 ml,"combination,oily,sensitive",TRUE,"acne,aging,pigmentation,redness","niacinamide,panthenol,resveratrol,ceramide-np,centella-asiatica","water(aqua),propanediol,glycerin,cyclohexasiloxane,1,2-hexanediol,niacinamide,caprylic/capric-triglyceride,panthenol,polyglycerin-3,polyglyceryl-10-stearate,hydrogenated-poly-(c6-14-olefin),hydrogenated-polydecene,coptis-japonica-root-extract,houttuynia-cordata-extract,oenothera-biennis-(evening-primrose)-flower-extract,lavandula-angustifolia-(lavender)-flower-extract,centella-asiatica-leaf-extract,opuntia-ficus-indica-stem-extract,gardenia-florida-fruit-extract,hibiscus-sabdariffa-flower-extract,corallina-officinalis-extract,sodium-hyaluronate,dicaprylyl-carbonate,c14-22-alcohols,ammonium-acryloyidimethyltaurate/vp-copolymer,polymethylsilsesquioxane,c12-20-alkyl-glucoside,butylene-glycol,acrylates/c10-30-alkyl-acrylate-crosspolymer,ethylhexylglycerin,polyquaternium-51,tromethamine,beta-glucan,resveratrol,hydrolyzed-hyaluronic-acid,tocopherol,ceramide-np,phenoxyethanol",neutral,gel-cream,all,"vegan,cruelty-free,fragrance-free,lightweight,non-comedogenic,soothing,brightening",both,daily,"A lightweight, restorative gel-cream designed to soothe post-acne sensitivity and repair the skin barrier. It combines soothing botanicals with barrier-strengthening ingredients to reduce redness and blemishes while providing anti-aging benefits.","Instantly soothes redness, fades post-acne marks, repairs skin barrier, hydrates without heaviness.",Apply an appropriate amount to cleansed and toned skin. Pat gently for better absorption. Can be used morning and night.,4.2,41501954441251,7176831991843
MASKS & PEELS,JM Solution,Active Astaxanthin Agecare Mask Prime 30ml,TRUE,Sheet Mask,? 170,30 ml,dry,TRUE,"aging,fine-lines,loss-of-elasticity","astaxanthin,bifida-ferment-lysate,hyaluronic-acid","water,glycerin,glycereth-26,methylpropanediol,peg/ppg-17/6-copolymer,phenoxyethanol,carbomer,polysorbate-20,triethanolamine,trehalose,hydroxyethyl-urea,betaine,glyceryl-glucoside,ethyl-hexyglycerin,niacinamide,adenosine,dipotassium-glycyrrhizate,xanthan-gum,hydroexethylcellulose,disodium-edta,isopropyl-myristate,fragrance,butylene-glycol,bifida-ferment-lysate,1,2-hexanediol,artemisia-princeps-leaf-extract,calendula-officinalis-extract,ci-16185,disodium-phosphate,polysorbate-60,acetyl-glucosamine,ci-19140,sea-water,glycine-max(soybean)-seed-extract,ulmus-campestris-(elm)-bark-extract,sodium-phosphate,astaxanthin-(100ppb),aspergillus-ferment,bacillus-ferment,lactobacillus-ferment,sodium-hyaluronate,glucose,hyaluronic-acid,hydrolyzed-hyaluronic-acid",neutral,microfiber-sheet,all,"anti-aging,firming,antioxidant-rich",evening,weekly,"An intensive anti-aging mask containing Astaxanthin, a powerful antioxidant known to be 6000x stronger than Vitamin C. It combats oxidative stress and firms sagging skin.","Reduces appearance of fine lines, improves skin elasticity, protects against free radicals, deeply hydrates.",Apply mask evenly to face. Remove after 15-20 minutes and pat essence into skin.,4.6,41501954539555,7176832090147
MASKS & PEELS,JM Solution,Active Astaxanthin Agecare Mask Prime x10 PCS,TRUE,Sheet Mask Pack,"? 1,700",10 Sheets,dry,TRUE,"aging,fine-lines,loss-of-elasticity","astaxanthin,bifida-ferment-lysate,hyaluronic-acid","water,glycerin,glycereth-26,methylpropanediol,peg/ppg-17/6-copolymer,phenoxyethanol,carbomer,polysorbate-20,triethanolamine,trehalose,hydroxyethyl-urea,betaine,glyceryl-glucoside,ethyl-hexyglycerin,niacinamide,adenosine,dipotassium-glycyrrhizate,xanthan-gum,hydroexethylcellulose,disodium-edta,isopropyl-myristate,fragrance,butylene-glycol,bifida-ferment-lysate,1,2-hexanediol,artemisia-princeps-leaf-extract,calendula-officinalis-extract,ci-16185,disodium-phosphate,polysorbate-60,acetyl-glucosamine,ci-19140,sea-water,glycine-max(soybean)-seed-extract,ulmus-campestris-(elm)-bark-extract,sodium-phosphate,astaxanthin-(100ppb),aspergillus-ferment,bacillus-ferment,lactobacillus-ferment,sodium-hyaluronate,glucose,hyaluronic-acid,hydrolyzed-hyaluronic-acid",neutral,microfiber-sheet,all,"anti-aging,firming,value-pack",evening,weekly,A value pack of 10 Astaxanthin masks. Provides a consistent anti-aging treatment course to firm sagging skin and reduce wrinkles over time.,"Reduces appearance of fine lines, improves skin elasticity, protects against free radicals, deeply hydrates.",Apply mask evenly to face. Remove after 15-20 minutes and pat essence into skin.,4.6,,
MASKS & PEELS,JM Solution,Active Golden Caviar Nourishing Mask Prime 30ml,TRUE,Sheet Mask,? 250,30 ml,dry,TRUE,"aging,dryness,dullness","caviar-extract,24k-gold,mugwort-extract","water,glycerin,glycereth-26,methylpropanediol,phenoxyethanol,trehalose,carbomer,allan-toin,betaine,peg-60-hydrogenated-castor-oil,triethanolamine,butylene-glycol,ethylhexylgly-cerin,disodi-um-edta,1,2-hexanediol,glyceryl-polyacrylate,caviar-extract(100ppm),sodium-hyaluronate,fragrance,chon-drus-crispus-powder,agar,synthetic-fluorphlogopite,titanium-dioxide,acrylates/c10-30-alkyl-acrylate-cro-sspolymer,tromethamine,artemisia-princeps-leaf-extract,calendula-officinalis-extract,ci-77491,mica,scute-llaria-baicalensis-root-extract,gellan-gum,tin-oxide,hyaluronic-acid,hydrolyzed-hyaluronic-acid,glucose.-gold(10ppb)",neutral,gel-essence-mask,cold-dry,"nourishing,luxurious,anti-aging,revitalizing",evening,weekly,"A premium nourishing mask featuring Golden Caviar and 24K Gold. It provides rich nutrition to rough, depleted skin, restoring a healthy glow and softness.","Deeply nourishes rough skin, improves texture, restores radiance, reduces tightness.",Apply mask and leave for 20 minutes. Ideal for dry winter days.,4.6,41501954572323,7176832122915
MASKS & PEELS,JM Solution,Active Pink Snail Brightening Mask 30ml,TRUE,Sheet Mask,? 170,30 ml,,TRUE,"dullness,pigmentation","snail-secretion-filtrate,vitamin-b12,niacinamide","water,glycerin,methylpropanediol,niacinamide,butylene-glycol,phenoxyethanol,peg-32,xanthan-gum,erythritol,trehalose,allantoin,polysorbate-20,snail-secretion-filtrate(1,000ppm),hydroxyethylcellulose,dimethicone,ethylhexylglycerin,1,2-hexanediol,disodium-edta,sodium-polyacrylate,hydrogenated-lecithin,dipotassium-glycyrrhizate,fragrance,disodium-phosphate,polysorbate-60,sodium-hyaluronate,sodium-phosphate,ci-15985,ci-16185,artemisia-princeps-leaf-extract,calendula-officinalis-extract,folic-acid,pyridoxine,riboflavin,thiamine-hcl-menadione,biotin,cyanocobalamin-(0.1ppb),glucose,hyaluronic-acid,hydrolyzed-hyaluronic-acid,panthenol,ascorbic-acid,bioflavonoids,glutathione,tocopheryl-acetate",neutral,soft-sheet,all,"brightening,revitalizing,vitality,glow",evening,weekly,A single brightening mask infused with Snail Secretion Filtrate and Vitamin B12. It revitalizes dull skin and fades acne scars.,"Instantly brightens dull skin, fades dark spots, provides deep hydration, strengthens skin barrier.",Apply to clean face after toner. Leave on for 10-20 minutes. Pat remaining essence into skin.,4.5,41501954605091,7176832155683
MASKS & PEELS,JM Solution,Active Pink Snail Brightening Mask x10PCS,TRUE,Sheet Mask Pack,"? 1,700",10 Sheets,,TRUE,"dullness,pigmentation","snail-secretion-filtrate,vitamin-b12,niacinamide","water,glycerin,methylpropanediol,niacinamide,butylene-glycol,phenoxyethanol,peg-32,xanthan-gum,erythritol,trehalose,allantoin,polysorbate-20,snail-secretion-filtrate(1,000ppm),hydroxyethylcellulose,dimethicone,ethylhexylglycerin,1,2-hexanediol,disodium-edta,sodium-polyacrylate,hydrogenated-lecithin,dipotassium-glycyrrhizate,fragrance,disodium-phosphate,polysorbate-60,sodium-hyaluronate,sodium-phosphate,ci-15985,ci-16185,artemisia-princeps-leaf-extract,calendula-officinalis-extract,folic-acid,pyridoxine,riboflavin,thiamine-hcl-menadione,biotin,cyanocobalamin-(0.1ppb),glucose,hyaluronic-acid,hydrolyzed-hyaluronic-acid,panthenol,ascorbic-acid,bioflavonoids,glutathione,tocopheryl-acetate",neutral,soft-sheet,all,"brightening,revitalizing,vitality,value-pack",evening,weekly,A value pack of 10 brightening masks infused with Snail Secretion Filtrate and Vitamin B12. Perfect for a consistent brightening routine to fade scars and restore vitality.,"Instantly brightens dull skin, fades dark spots, provides deep hydration, strengthens skin barrier.",Apply to clean face after toner. Leave on for 10-20 minutes. Pat remaining essence into skin.,4.5,,
MASKS & PEELS,JM Solution,Active Pink Snail Whitening Mask (Premium),TRUE,Sheet Mask,? 250,30 ml,,TRUE,"dullness,pigmentation","snail-secretion-filtrate,niacinamide,vitamin-b12","water,butylene-glycol,niacinamide,isopentyldiol,1,2-hexanediol,dipropylene-glycol,hydroxyacetophenone,ar-ginine,carbomer,allantoin,snail-secretion-filtrate(1,010pm),polyglyceryl-10-laurate,hydroxyethylcellulose,xanthan-gum,disodium-edta,dipotassium-glycyrrhizate,ethylhexylglycerin,fragrance,zingiber-officinale-(ginger)-root-extract,beta-glu-can,betaine,tocopheryl-acetate,prunus-serrulata-flower-extract,caprylyl-glycol,sodium-hyaluronate",neutral,soft-sheet,all,"brightening,whitening,vitality,healing",evening,weekly,"The Premium 'Whitening' version of the Pink Snail mask, often featuring a higher concentration of Niacinamide (5%) for intensive spot correction and brightening.","Intensively brightens skin, fades stubborn dark spots, promotes skin healing, evens complexion.",Apply to clean face. Leave on for 10-20 minutes. Pat remaining essence into skin.,4.6,41501954637859,7176832188451
MOISTURIZERS,COSRX,Advanced Snail 92 All In One Cream,TRUE,Face Cream,"? 1,650",100 g,,TRUE,"aging,dryness,texture","snail-secretion-filtrate,hyaluronic-acid,adenosine","snail-secretion-filtrate,betaine,caprylic/capric-triglyceride,cetearyl-olivate,sorbitan-olivate,sodium-hyaluronate,cetearyl-alcohol,stearic-acid,arginine,dimethicone,carbomer,panthenol,allantoin,sodium-polyacrylate,xanthan-gum,ethyl-hexanediol,adenosine,phenoxyethanol",neutral,slimy-gel-cream,all,"soothing,repairing,anti-aging,hydration",both,daily,"COSRX Snail 92 All In One Cream is a light weight, nutritious moisturiser packed with snail mucin. The Advanced Snail 92 All In One Cream is formulated with 92% snail mucin and hyaluronic acid that helps to strengthen, restore and repair damaged skin. The snail 92 also helps to plumps the skin and support skin elasticity. Suitable for all skin types especially Oily or dull, dehydrated skin type. For best results, use with Advanced Snail 96 Mucin Power Essence.","Soothes irritation, hydrates, improves skin elasticity, repairs skin barrier.",Gently apply a proper amount of the cream to face. Tap the area where the cream was applied gently in order for it to be absorbed along the skin texture.,4.9,41501954670627,7176832221219
SERUMS & AMPOULES,COSRX,Advanced Snail 96 Mucin Power Essence,TRUE,Essence,"? 1,450",100 ml,,TRUE,"dark-spots,dehydration,dullness","snail-secretion-filtrate,sodium-hyaluronate,panthenol","snail-secretion-filtrate,betaine,butylene-glycol,1-2-hexanediol,sodium-polyacrylate,phenoxyethanol,sodium-hyaluronate,allantoin,ethyl-hexanediol,carbomer,panthenol,arginine",neutral,viscous-gel,all,"repairing,hydrating,glow-boosting,fades-scars",both,daily,"The COSRX Snail 96 Mucin Power Essence is a cult favorite essence loaded with 96% snail mucin extract to replenish and repair damaged skin to its healthiest. Snail is known for its powerful skin-transforming and repairing properties. The Snail Mucin helps the skin to prevent and repair damages and fills the skin with elasticity for healthier, younger-looking skin. It has the ability to repair everything from dry patches to acne breakouts, and lightening hyperpigmentation with regular use.","Repairs damaged skin, fades acne scars, deep hydration, improves texture.","After cleansing and toning, apply a small amount on your entire face. Gently pat using fingertips to aid absorption.",4.9,41501954703395,7176832253987
CLEANSERS,COSRX,Advanced Snail Mucin Gel Cleanser,TRUE,Gel Cleanser,"? 1,350",150 ml,"dry,sensitive",TRUE,"dryness,sensitivity","snail-secretion-filtrate,glycerin,arginine","water,acrylates-copolymer,butylene-glycol,glycerin,disodium-laureth-sulfosuccinate,sodium-cocoyl-isethionate,1-2-hexanediol,coco-glucoside,lauryl-betaine,snail-secretion-filtrate,arginine,tromethamine,potassium-cocoyl-glycinate,fragrance,carbomer,sodium-chloride,ethylhexylglycerin,acrylates/c10-30-alkyl-acrylate-crosspolymer,sodium-polyacrylate,disodium-edta",neutral,gel,all,"hydrating,repairing,gentle-cleansing,non-stripping",both,daily,"The COSRX Advanced Snail Mucin Gel Cleanser lightly foams to rinse away dirt, oil, and makeup without disturbing your skin's natural barrier.","Cleanses without stripping, hydrates and repairs, soothes irritation, leaves skin soft.",Lather with water and massage onto face. Rinse thoroughly.,4.9,41501954736163,7176832286755
MASKS & PEELS,COSRX,Advanced Snail Mucin Power Sheet Mask 10pcs,TRUE,Sheet Mask Pack,"? 2,500",10 Sheets,"dry,sensitive",TRUE,"dryness,dullness,sensitivity","snail-secretion-filtrate,niacinamide","water,butylene-glycol,glycerin,snail-secretion-filtrate,1-2-hexanediol,panthenol,hydroxyacetophenone,hexylene-glycol,xanthan-gum,dipropylene-glycol,sodium-polyacrylate,allantoin,hydroxyethylcellulose,sodium-hyaluronate,disodium-edta,dipotassium-glycyrrhizate,melaleuca-alternifolia-leaf-oil,polyglyceryl-10-laurate,polyglyceryl-10-myristate",neutral,cellulose-sheet,all,"repairing,hydrating,soothing,value-pack",evening,weekly,"The COSRX Snail Mucin Sheet Mask, soaked in 35,000 ppm of concentrated snail mucin, provides intense hydration, nourishment, and skin-repairing benefits. This star ingredient is celebrated for its ability to soothe irritation, restore skin vitality, and promote collagen production, resulting in smoother, plumper, and healthier-looking skin over time. With each use, the mask helps fade dark spots, reduce redness, and enhance elasticity, making it ideal for dry, tired, or compromised skin.","Instantly hydrates, calms redness, repairs damage, leaves skin plump.",Apply to face. Leave for 10-20 mins. Pat essence.,4.7,41842134319139,7179631755299
SERUMS & AMPOULES,COSRX,Advanced Snail Radiance Dual Essence,TRUE,Essence,"? 2,450",80 ml,,TRUE,"dryness,dullness,loss-of-elasticity","snail-secretion-filtrate,niacinamide,glutathione","snail-secretion-filtrate,butylene-glycol,niacinamide,1-2-hexanediol,betaine,panthenol,water,glycerin,limnanthes-alba-seed-oil,helianthus-annuus-seed-oil,allantoin,carbomer,macadamia-ternifolia-seed-oil,sodium-polyacrylate,sodium-hyaluronate,inulin-lauryl-carbamate,arginine,argania-spinosa-kernel-oil,xanthan-gum,sodium-surfactin,ethylhexylglycerin,glutathione",neutral,dual-phase-gel,all,"brightening,anti-aging,multi-tasking,hydrating",both,daily,"Achieve Glowing and Youthful skin with the COSRX Advanced Snail Radiance Dual Essence. The COSRX Advanced Snail Radiance Dual Essence is a unique essence with a dual formula to boost skin elasticity and radiance at the same time. A blend of two separate essences which are freshly formulated into one when pumped out of the tube for use. It contains triple snail complex formula that helps to improve Moisture Retention, Pore Control, & Skin Elasticity.","Brightens and hydrates at once, improves elasticity, fades dark spots, plumps skin.",Pump the dual essence and mix the two textures. Apply to face.,4.9,41501954768931,7176832319523
SERUMS & AMPOULES,COSRX,AHA 7 Whitehead Power Liquid,TRUE,Exfoliant,"? 1,350",100 ml,"combination,dry",FALSE,"dullness,texture,whiteheads","apple-fruit-water,glycolic-acid,niacinamide","pyrus-malus-fruit-water,butylene-glycol,glycolic-acid,water,niacinamide,sodium-hydroxide,1-2-hexanediol,panthenol,sodium-hyaluronate,xanthan-gum,ethyl-hexanediol",neutral,liquid,all,"texture-smoothing,brightening,whitehead-removal,chemical-exfoliation",evening,2-3-times-a-week,"Say goodbye to stubborn whiteheads & dull skin! The COSRX AHA 7 Whitehead Power Liquid is your go-to exfoliating solution for clearer, smoother, and brighter skin. Powered by 7% Glycolic Acid (AHA), this gentle yet effective chemical exfoliant helps to unclog pores, remove dead skin cells, and fade hyperpigmentation—revealing a fresh, radiant glow.","Clears whiteheads, smooths rough texture, brightens skin tone, resurfaces skin.",Apply to skin with a cotton pad. Start with once a week and increase frequency.,4.8,41501954801699,7176832352291
TONERS,SOME BY MI,AHA BHA PHA 30 Days Miracle Toner,TRUE,Exfoliating Toner,"? 1,550",150 ml,"oily,sensitive",FALSE,"acne,large-pores,texture","tea-tree-leaf-water,niacinamide,salicylic-acid,lactobionic-acid","water,butylene-glycol,dipropylene-glycol,glycerin,niacinamide,melaleuca-alternifolia-leaf-extract,polyglyceryl-4-caprate,carica-papaya-fruit-extract,lens-esculenta-seed-extract,hamamelis-virginiana-extract,nelumbo-nucifera-flower-extract,swiftlet-nest-extract,sodium-hyaluronate,fructan,allantoin,adenosine,hydroxyethyl-urea,xylitol,salicylic-acid,lactobionic-acid,citric-acid,sodium-citrate,1-2-hexanediol,pentylene-glycol,caprylyl-glycol,benzyl-glycol,ethylhexylglycerin,ethyl-hexanediol,raspberry-ketone,phenoxyethanol,mentha-piperita-oil",neutral,watery,hot-humid,"acne-care,exfoliating,pore-care,pH-balanced",evening,daily,"Some By Mi 30 Days Miracle Toner is your skincare secret for radiant skin. With AHA, BHA, and PHA, it gently exfoliates, removing dead skin cells and impurities. Enriched with Tea Tree and Witch Hazel, it soothes and tightens pores, while balancing oil for a clear, refreshed complexion.
","Exfoliates dead skin, clears clogged pores, calms inflammation, controls sebum.",Soak a cotton pad with toner and wipe gently across the face. Pat for absorption.,4.5,41501954867235,7176832417827
TONERS,COSRX,AHA BHA Vitamin C Daily Toner,TRUE,Exfoliating Toner,"? 1,250",150 ml,,FALSE,"dullness,texture,uneven-skin-tone","kiwi-fruit-extract,dragon-fruit-extract,glycolic-acid,niacinamide","actinidia-chinensis-fruit-extract,hylocereus-undatus-fruit-extract,salix-alba-bark-water,pyrus-malus-fruit-water,butylene-glycol,niacinamide,1-2-hexanediol,ethyl-hexanediol,sodium-lactate,water,glycolic-acid,allantoin,panthenol,adenosine,betaine-salicylate,ascorbyl-glucoside",neutral,watery,all,"brightening,refreshing,daily-exfoliation,vitality",morning,daily,"Tired of dull, uneven skin? The COSRX AHA BHA Vitamin C Daily Toner is here to help! This gentle, multi-functional toner is formulated with AHAs, BHAs, and Vitamin C to tackle common skin issues like hyperpigmentation, dull skin and acne scars:","Brightens skin tone, smooths texture, unclogs pores, refreshes tired skin.",Pour onto a cotton pad and wipe gently across the face.,4.7,41501954900003,7176832450595
TONERS,COSRX,AHA/BHA Clarifying Treatment Toner,TRUE,Exfoliating Toner,"? 1,090",150 ml,oily,FALSE,"blackheads,texture,whiteheads","willow-bark-water,apple-fruit-water,glycolic-acid,betaine-salicylate","mineral-water,salix-alba-bark-water,pyrus-malus-fruit-water,butylene-glycol,1-2-hexanediol,sodium-lactate,glycolic-acid,water,betaine-salicylate,allantoin,panthenol,ethyl-hexanediol",neutral,watery-mist,all,"gentle-exfoliation,pore-care,texture-smoothing,daily-use",evening,daily,"The COSRX AHA/BHA Clarifying Treatment Toner is a gentle, exfoliating toner formulated to enhance skin texture, boost vitality, and manage pores. This toner is suitable for all skin types, including sensitive skin, and is designed to promote a clearer, more refined complexion.","Clears whiteheads and blackheads, smooths skin texture, prevents breakouts, mild enough for daily use.",Spray onto a cotton pad and swipe over face. Avoid eye and mouth area.,4.8,41501954834467,7176832385059
SUNSCREENS,COSRX,Aloe Soothing Sun Cream SPF50+ PA+++,TRUE,Hybrid Sunscreen,"? 1,050",50 ml,"dry,normal,sensitive",TRUE,"dryness,redness,sun-protection","aloe-arborescens-leaf-extract,glycerin,tocopheryl-acetate","ethylhexyl-methoxycinnamate,glycerin,propylene-glycol,cyclopentasiloxane,bis-ethylhexyloxyphenol-methoxyphenyltriazine,phenylbenzimidazolesulfonic-acid,dicaprylyl-carbonate,cetyl-alcohol,polymethyl-methacrylate,cetearyl-alcohol,aloe-arborescens-leaf-extract,potassium-cetyl-phosphate,ethanol,dimethicone,glyceryl-stearate,butylene-glycol,titanium-dioxide,c14-22-alcohol,dipotassium-glycyrrhizate,tocopheryl-acetate,peg-100-stearate,silica,c12-20-alkyl-glucoside,dimethicone/vinyl-dimethicone-crosspolymer,aluminum-hydroxide,stearic-acid,caprylyl-glycol,acrylates/c10-30-alkyl-acrylate-crosspolymer,carbomer,xanthan-gum,triethanolamine,sodium-hydroxide,fragrance,phenoxyethanol,disodium-edta",neutral,cream,all,"soothing,moisturizing,no-white-cast,daily-use",morning,daily,"Looking for sunscreen that doubles as a moisturizer? You're looking at the COSRX Aloe Soothing Sun Cream, a sunscreen and a cream at the same time. This Korean sunscreen by COSRX moisturizes and hydrates dull, dry skin while being lightweight and protecting your skin from the harsh outdoor sun effortlessly - all day long* Plus, what makes it even better is the fact that it gives off zero white-cast.","Protects against UV rays, soothes redness, hydrates skin, no white cast.",Apply a generous amount to face 30 minutes before sun exposure. Reapply as needed.,4.8,41501954932771,7176832483363
SERUMS & AMPOULES,AXIS-Y,Artichoke Intensive Skin Barrier Ampoule,TRUE,Barrier Ampoule,"? 1,650",30 ml,"combination,normal,oily",TRUE,"dryness,sensitivity,texture","artichoke-extract,hawkweed-extract,centella-asiatica,aloe-vera","water,aloe-barbadensis-leaf-water,butylene-glycol,sodium-hyaluronate,centella-asiatica-extract,glycerin,betaine,propanediol,glycyrrhiza-uralensis-(licorice)-root-extract,hieracium-umbellatum-extract,cynara-scolymus-(artichoke)-leaf-extract-(10,000ppm),sorbitol,aloe-barbadensis-leaf-extract,dioscorea-japonica-root-extract,laminaria-japonica-extract,1,2-hexanediol,xanthan-gum,carbomer,linum-usitatissimum-(linseed)-seed-extract,hibiscus-esculentus-fruit-extract,aloe-barbadensis-leaf-juice,arctium-lappa-root-extract,hibiscus-mutabilis-flower-extract,corchorus-olitorius-leaf-extract,rheum-palmatum-root-extract,althaea-rosea-flower-extract,dimethyl-sulfone,chlorphenesin,ethylhexylglycerin,polyglutamic-acid,beta-glucan,arginine,allantoin,adenosine",neutral,lightweight-liquid,all,"barrier-repair,healing,soothing,hydrating",both,daily,"The Axis-Y Artichoke Intensive Skin Barrier Ampoule is designed to strengthen and repair the skin barrier, providing deep hydration and protection against environmental stressors. This ampoule focuses on enhancing the skin's natural defense mechanisms, improving texture, and reducing the appearance of fine lines and wrinkles.","Repairs skin barrier, retains moisture, tightens pores, calms inflammation.",Apply directly onto skin after toning. Pat gently until absorbed.,4.4,41501954965539,7176832516131
MOISTURIZERS,Cathy Doll,Bare Heart Perfume Lotion,TRUE,Body Lotion,? 999,150 ml,,FALSE,"dryness,dullness","niacinamide,vitamin-e,shea-butter,arbutin","aqua,fragrance,cetearyl-alcohol,glyceryl-stearate,mineral-oil,peg-100-stearate,allantoin,phenoxyethanol,dimethicone,carbomer,triethano-lamine,polyacrylamide,methylparaben,c13-14-isoparaffin,propylparaben,xanthan-gum,laureth-7,alpha-arbutin,ascorbic-acid,punica-granatum-seed-oil,tocopherol,c/-16035",female,lotion,all,"fragrance-rich,brightening,hydrating,non-sticky",both,daily,"Cathy Doll Bare Heart Perfume Lotion wraps your skin in lightweight hydration that moisturizes without stickiness. Designed to reveal glowing skin with a radiant finish, it combines brightening care with a delicate floral scent that feels refined and romantic. With every use, it restores softness to dry skin and enhances natural radiance—leaving behind silky smoothness and confidence that lasts.","Long-lasting fragrance, hydrates skin, brightens tone, non-sticky finish.",Apply liberally to the body morning and night.,4.8,41501954998307,7176832548899
SERUMS & AMPOULES,COSRX,BHA Blackhead Power Liquid,TRUE,Exfoliant,"? 1,590",100 ml,oily,FALSE,"blackheads,large-pores,oiliness","willow-bark-water,betaine-salicylate,niacinamide","salix-alba-bark-water,butylene-glycol,betaine-salicylate,niacinamide,1-2-hexanediol,arginine,panthenol,sodium-hyaluronate,xanthan-gum,ethyl-hexanediol",neutral,liquid,all,"pore-clearing,blackhead-removal,oil-control,chemical-exfoliation",evening,2-3-times-a-week,"Say goodbye to stubborn blackheads & congestion! The COSRX BHA Blackhead Power Liquid is a game-changing exfoliant formulated with 4% Betaine Salicylate (a gentle yet effective BHA) to unclog pores, control excess oil, and prevent future breakouts—all while keeping your skin hydrated and irritation-free.","Removes blackheads, clears clogged pores, controls oil, prevents breakouts.",Apply to target areas or full face using a cotton pad. Wait 20 mins before next step.,4.7,41501955031075,7176832581667
