CATEGORY,BRAND,NAME,INSTOCK,SUBCATEGORY,MRP,WEIGHT,SKINTYPES,SENSITIVITYSAFE,CONCERNADDRESSED,KEYINGREDIENTS,FULLINGREDIENTLIST,GENDER,TEXTURE,CLIMATESUITABILITY,PREFERENCES,USAGE,FREQUENCY,DESCRIPTION,BENEFITS,INSTRUCTIONS,RATING, SHOPIFYVARIANTID,SHOPIFYPRODCUTID
MOISTURIZERS,Beauty of Joseon,Dynasty Cream,TRUE,Face Cream,"? 2,000",50 ml,"dry,normal",TRUE,"dryness,dullness,sensitivity","rice-bran-water,ginseng-root-water,squalane,niacinamide","water,oryza-sativa-(rice)-bran-water,glycerin,panax-ginseng-root-water,hydrogenated-polydecene,1,2-hexanediol,niacinamide,squalane,butylene-glycol,propanediol,dicaprylate/dicaprate,cetearyl-olivate,sorbitan-olivate,ammonium-acryloyldimethyltaurate/vp-copolymer,xanthan-gum,acrylates/c10-30-alkyl-acrylate-crosspolymer,tromethamine,carthamus-tinctorius-(safflower)-seed-oil,hydrogenated-coconut-oil,glyceryl-acrylate/acrylic-acid-copolymer,ethylhexylglycerin,adenosine,caprylic/capric-triglyceride,disodium-edta,hyaluronic-acid,hydrolyzed-hyaluronic-acid,sodium-hyaluronate,honey-extract,ceramide-np,hydrogenated-lecithin,coptis-japonica-root-extract,raphanus-sativus-(radish)-seed-extract,lycium-chinense-fruit-extract,theobroma-cacao-(cocoa)-seed-extract,phellinus-linteus-extract,dextrin,scutellaria-baicalensis-root-extract",neutral,rich-cream,cold-dry,"hanbang-ingredients,deep-moisture,anti-aging,dewy-finish",both,daily,"A rich, hydrating moisturizer formulated with key ingredients such as ginseng and rice water. Made to brighten, firm, and smooth skin while locking in moisture. Ideal for those with dry or mature skin seeking a deep hydration boost and a more youthful skin texture and complexion.","Deeply moisturizes, strengthens barrier, brightens tone, anti-aging.",Apply a proper amount to face at the last step of skincare. Massage gently.,5,41501955784739,7176833171491
SERUMS & AMPOULES,"Dear, Klairs",Freshly Juiced Vitamin Drop,TRUE,Vitamin C Serum,"? 1,570",35 ml,sensitive,FALSE,"dullness,large-pores,pigmentation","ascorbic-acid,centella-asiatica-extract,yuzu-extract","water,propylene-glycol,ascorbic-acid,hydroxyethylcellulose,centella-asiatica-extract,citrus-junos-fruit-extract,illicium-verum-fruit-extract,citrus-paradisi-fruit-extract,nelumbium-speciosum-flower-extract,paeonia-suffruticosa-root-extract,scutellaria-baicalensis-root-extract,polysorbate-60,brassica-oleracea-italica-extract,chaenomeles-sinensis-fruit-extract,citrus-aurantium-dulcis-oil,sodium-acrylate/sodium-acryloyldimethyl-taurate-copolymer,disodium-edta,lavandula-angustifolia-oil,camellia-sinensis-callus-culture-extract,larix-europaea-wood-extract,chrysanthellum-indicum-extract,rheum-palmatum-root-extract,asarum-sieboldi-root-extract,quercus-mongolia-leaf-extract,persicaria-hydropiper-extract,corydalis-turtschaninovii-root-extract,coptis-chinensis-root-extract,magnolia-obovata-bark-extract,lysine-hcl,proline,sodium-ascorbyl-phosphate,acetyl-methionine,theanine,lecithin,acetyl-glutamine,sh-olgopeptide-1,sh-olgopeptide-2,sh-polypeptide-1,sh-polypeptide-9,sh-polypeptide-11,bacillus/soybean/folic-acid-ferment-extract,sodium-hyaluronate,caprylyl-glycol,butylene-glycol,1-2-hexanediol",neutral,lightweight-oil,all,"hypoallergenic,vegan,brightening,pore-care",evening,daily,"Please note: Vitamin C serums may experience slight oxidation over time, resulting in a change in color. However, they remain safe to use and continue to offer the same skincare benefits, such as brightening, antioxidant protection, and improved skin tone","Fades dark spots, brightens dull skin, tightens pores, gentle for sensitive skin.","Apply to clean face. For sensitive skin, mix a few drops with moisturizer or apply after toner. Use SPF in the morning.",4.3,41501955817507,7176833204259
MASKS & PEELS,"Dear, Klairs",Freshly Juiced Vitamin E Mask 15g (Mini),TRUE,Sleeping Mask,? 750,15 g,,TRUE,"aging,dryness,dullness","vitamin-e,niacinamide,adenosine,ceramide-np","water,glycerin,butylene-glycol,tocopheryl-acetate,niacinamide,sodium-hyaluronate,carrageenan,gellan-gum,betaine,algin,mannan,ceramide-np,peg-60-hydrogenated-castor-oil,acrylates/c10-30-alkyl-acrylate-crosspolymer,chlorphenesin,arginine,ethylhexylglycerin,centella-asiatica-extract,rubus-fruticosus-fruit-extract,salicornia-herbacea-extract,phragmites-communis-extract,adenosine,lavandula-angustifolia-oil,eucalyptus-globulus-leaf-oil,pelargonium-graveolens-flower-oil,citrus-limon-peel-oil,citrus-aurantium-dulcis-peel-oil,cananga-odorata-flower-oil",neutral,pudding-like,all,"multi-use,antioxidant,brightening,travel-size",evening,daily,"Klairs Freshly Juiced Vitamin E Mask is a versatile skincare essential, serving as a mask, sleeping pack, or daily moisturizer. Ideal for daytime use, it shields the skin from UV damage, and at night, it aids in skin regeneration and wrinkle reduction. This formula is enriched with vitamin E, niacinamide, and adenine, offering antioxidant benefits, improving wrinkles, and promoting a bright, healthy complexion. The mask’s budding like texture transforms into a rich essence on the skin, ensuring at least 8 hours of moisture, even for dry types.","Brightens skin, improves wrinkles, hydrates for 8 hours, boosts Vitamin C efficacy.",Apply as a moisturizer or a thick layer as a sleeping mask.,4.5,41501955883043,7176833269795
MASKS & PEELS,"Dear, Klairs",Freshly Juiced Vitamin E Mask 90ml,TRUE,Sleeping Mask,"? 1,850",90 ml,,TRUE,"aging,dryness,dullness","vitamin-e,niacinamide,adenosine,ceramide-np","water,glycerin,butylene-glycol,tocopheryl-acetate,niacinamide,sodium-hyaluronate,carrageenan,gellan-gum,betaine,algin,mannan,ceramide-np,peg-60-hydrogenated-castor-oil,acrylates/c10-30-alkyl-acrylate-crosspolymer,chlorphenesin,arginine,ethylhexylglycerin,centella-asiatica-extract,rubus-fruticosus-fruit-extract,salicornia-herbacea-extract,phragmites-communis-extract,adenosine,lavandula-angustifolia-oil,eucalyptus-globulus-leaf-oil,pelargonium-graveolens-flower-oil,citrus-limon-peel-oil,citrus-aurantium-dulcis-peel-oil,cananga-odorata-flower-oil",neutral,pudding-like,all,"multi-use,antioxidant,brightening,large-size",evening,daily,"Dear Klairs Freshly Juiced Vitamin E Mask is a versatile skincare essential, serving as a mask, sleeping pack, or daily moisturizer. Ideal for daytime use, it shields the skin from UV damage, and at night, it aids in skin regeneration and wrinkle reduction. This formula is enriched with vitamin E, niacinamide, and adenine, offering antioxidant benefits, improving wrinkles, and promoting a bright, healthy complexion. The mask’s budding like texture transforms into a rich essence on the skin, ensuring at least 8 hours of moisture, even for dry types. For optimal results, use it with vitamin C to achieve brighter, firmer, and hydrated skin.","Brightens skin, improves wrinkles, hydrates for 8 hours, boosts Vitamin C efficacy.",Apply as a moisturizer or a thick layer as a sleeping mask.,4.6,41501955915811,7176833302563
CLEANSERS,"Dear, Klairs",Gentle Black Fresh Cleansing Oil,TRUE,Oil Cleanser,"? 1,650",150 ml,"combination,oily,sensitive",TRUE,"large-pores,oiliness,pores","sunflower-seed-oil,grape-seed-oil,jojoba-seed-oil,black-currant-seed-oil","helianthus-annuus-seed-oil,caprylic/capric-triglyceride,peg-20-glyceryl-triisostearate,vitis-vinifera-seed-oil,simmondsia-chinensis-seed-oil,ribes-nigrum-seed-oil",neutral,light-oil,all,"non-comedogenic,fragrance-free,lightweight,deep-cleansing",evening,daily,"Introducing Dear Klairs Gentle Black Fresh Cleansing Oil, your go-to solution for effortless and effective makeup removal. Formulated with a blend of natural oils, this lightweight cleansing oil gently dissolves makeup, impurities, and excess oil without stripping the skin's natural moisture barrier. Its non-irritating formula is suitable for sensitive skin, free from artificial fragrances and colorants. Experience deep cleansing that leaves your skin feeling clean, soft, and refreshed, with a nourishing touch of antioxidants and vitamins.","Emulsifies quickly, removes waterproof makeup, controls sebum, fresh finish.",Massage onto dry face to dissolve makeup. Add water to emulsify (turn milky) and rinse off.,4.7,41501955948579,7176833302563
CLEANSERS,Beauty of Joseon,Ginseng Cleansing Oil,TRUE,Cleansing Oil,"? 1,670",210 ml,"combination,dry,normal",TRUE,"dryness,pores","soybean-oil,ginseng-seed-oil","glycine-soja-(soybean)-oil,cetyl-ethylhexanoate,sorbeth-30-tetraoleate,isododecane,olea-europaea-(olive)-fruit-oil,camellia-japonica-seed-oil,hydrogenated-coconut-oil,octyldodecanol,polybutene,caprylic/capric-triglyceride,water,tocopherol,salvia-officinalis-(sage)-oil,panax-ginseng-seed-oil,artemisia-vulgaris-oil,ocimum-basilicum-(basil)-oil,corylus-avellana-(hazelnut)-seed-oil,nigella-sativa-seed-oil,butylene-glycol,panax-ginseng-berry-extract,glycerin,1,2-hexanediol,methylpropanediol,panax-ginseng-root-extract,panax-ginseng-root-extract,ethyl-hexanediol,panax-ginseng-extract,panax-ginseng-leaf/stem-extract,ethylhexylglycerin",neutral,lightweight-oil,all,"micellar-technology,fragrance-free,deep-cleansing,emulsifies-quickly",evening,daily,"Cleansing is the foundation of healthy skin, and this cleansing oil is formulated to gently yet effectively remove impurities, makeup, and sebum without stripping away natural moisture.","Dissolves impurities and makeup, cleanses pores, moisturizes, herbal scent.",Pump onto dry hands and massage onto dry face. Rinse with lukewarm water.,4,41501955981347,7176833335331
TONERS,Beauty of Joseon,Ginseng Essence Water,TRUE,Essence Toner,"? 1,500",150 ml,dry,TRUE,"dehydration,dullness,fine-lines","ginseng-root-water,niacinamide,adenosine","panax-ginseng-root-water,butylene-glycol,glycerin,propanediol,niacinamide,1,2-hexanediol,water,hydroxyacetophenone,glyceryl-glucoside,xanthna-gum,panthenol,dipotassium-glycyrrhizate,allantoin,adenosine,panax-ginseng-callus-culture-extract,theobroma-cacao(cocoa)-extract,dextrin,glucose,panax-ginseng-root-extract,panax-ginseng-berry-extract,lactobacillus/panax-ginseng-root-ferment-filtrate,sodium-hyaluronate,ethylhexyglycerin,disodium-edta",neutral,watery-liquid,all,"hydrating,revitalizing,fragrance-free,alcohol-free",morning,daily,"Hydrates, nourish and restore dull and dehydrated skin with Beauty of Joseon Ginseng Essence Water. Infused with 80% Ginseng root water and 2% Niacinamide, this essence harnesses the ancient wisdom of Korean beauty to deeply hydrate, nourish, and brighten your skin.","Deeply hydrates, controls sebum, brightens skin tone, improves texture.",Apply a few drops to hands or cotton pad and pat onto face after cleansing.,5,41501956014115,7176833368099
SERUMS & AMPOULES,Beauty of Joseon,Glow Deep Serum: Rice + Alpha-Arbutin,TRUE,Brightening Serum,"? 1,400",30 ml,normal,FALSE,"dullness,pigmentation,uneven-skin-tone","rice-bran-water,alpha-arbutin,niacinamide","oryza-sativa-(rice)-bran-water,water,glycerin,butylene-glycol,1,2-hexanediol,dipropylene-glycol,alpha-arbutin,niacinamide,methyl-gluceth-20,panthenol,polyglycerin-3,trehalose,glyceryl-glucoside,hydrolyzed-jojoba-esters,hydroxyethyl-acrylate/sodium-acryloyldimethyl-taurate-copolymer,ethylhexylglycerin,hydroxyethylcellulose,xanthan-gum,arginine,acrylates/c10-30-alkyl-acrylate-crosspolymer,arginine,disodium-edta,coptis-japonica-root-extract,sorbitan-isostearate,glucose,coix-lacryma-jobi-ma-yuen-seed-extract,glycine-soja-(soybean)-seed-extract,hordeum-distichon-(barley)-extract,oryza-sativa-(rice)-extract,sesamum-indicum-(sesame)-seed-extract,triticum-vulgare-(wheat)-seed-extract,vigna-radiata-seed-extract,zea-mays-(corn)-kernel-extract",neutral,lightweight-liquid,all,"brightening,pigmentation-care,fragrance-free,vegan",both,daily,"Reduce dull and uneven tone with Beauty of Joseon Glow Deep Serum. Infused with 68% rice bran water and 2% alpha-arbutin, this serum targets pigmentation and uneven skin tone, revealing a brighter, more radiant complexion.","Fades dark spots, evens skin tone, hydrates without stickiness, inhibits melanin.",Apply 2-3 drops to face after toning. Pat gently to absorb.,4.6,41501956046883,7176833400867
SERUMS & AMPOULES,Beauty of Joseon,Glow Serum: Propolis + Niacinamide,TRUE,Pore Serum,"? 1,400",30 ml,oily,TRUE,"acne,large-pores,redness","propolis-extract,niacinamide,betaine-salicylate","propolis-extract,dipropylene-glycol,glycerin,butylene-glycol,water,niacinamide,1,2-hexanediol,melia-azadirachta-flower-extract,melia-azadirachta-leaf-extract,sodium-hyaluronate,curcuma-longa-(turmeric)-root-extract,ocimum-sanctum-leaf-extract,theobroma-cacao-(cocoa)-seed-extract,melaleuca-alternifolia-(tea-tree)-extract,centella-asiatica-extract,corallina-officinalis-extract,lotus-corniculatus-seed-extract,calophyllum-inophyllum-seed-oil,betaine-salicylate,sodium-polyacryloyldimethyl-taurate,tromethamine,polyglyceryl-10-laurate,caprylyl-glycol,ethylhexylglycerin,dextrin,pentylene-glycol,octanediol,tocopherol,xanthan-gum,carbomer",neutral,honey-like,hot-humid,"acne-care,pore-refining,glow-boosting,anti-inflammatory",both,daily,"Soothe and balance your skin with the Beauty of Joseon Glow Serum. Formulated with 60% propolis extract and 2% niacinamide, this serum targets enlarged pores, inflammation, and excess sebum while maintaining hydration.","Reduces acne and inflammation, minimizes pores, controls oil, hydrates.",Apply 2-3 drops to face. Focus on T-zone or acne-prone areas.,4.9,41501956079651,7176833433635
CLEANSERS,Isntree,Green Tea Fresh Cleanser,TRUE,Gel Cleanser,"? 1,250",120 ml,"combination,oily",TRUE,"oiliness,pores","green-tea-extract,4-types-hyaluronic-acid,anti-sebum-p","water,glycerin,sodium-cocoyl-alaninate,disodium-cocoamphodiacetate,butylene-glycol,sodium-methyl-cocoyl-taurate,1,2-hexanediol,lauryl-hydroxysultaine,xanthan-gum,sodium-chloride,caprylyl-glycol,acrylates/c10-30-alkyl-acrylate-crosspolymer,camellia-sinensis-leaf-powder(3,000-ppm),camellia-sinensis-leaf(2,000-ppm),camellia-sinensis-leaf-extract(2,000-ppm),sodium-phytate,malt-extract,hexylene-glycol,oenothera-biennis-(evening-primrose)-flower-extract,pinus-palustris-leaf-extract,pueraria-thunbergiana-root-extract,ulmus-davidiana-root-extract,ethylhexylglycerin,hydrolyzed-glycosaminoglycans,propanediol,sodium-hyaluronate-crosspolymer,sodium-hyaluronate,benzyl-glycol,hydrolyzed-hyaluronic-acid,hyaluronic-acid",neutral,brown-gel,hot-humid,"low-ph,non-stripping,pore-cleansing,soothing",both,daily,"The Isntree Green Tea Fresh Cleanser is an amazing daily cleanser— especially for oily, combination, and acne-prone skin types. If you're looking for a non-stripping, balancing cleanser that supports oily and acne-prone skin — without compromising hydration — this is the best cleanser.
","Cleanses pores, controls oil, balances skin pH, hydrates while cleansing.",Lather a pea-sized amount with water. Massage onto face and rinse.,4.7,41501956112419,7176833466403
TONERS,Isntree,Green Tea Fresh Toner 200ml,TRUE,Balancing Toner,"? 1,250",200 ml,"combination,oily",TRUE,"large-pores,oiliness,texture","green-tea-extract,anti-sebum-p,centella-asiatica","camellia-sinensis-leaf-extract,water,ginkgo-biloba-leaf-extract,centella-asiatica-extract,salix-alba-bark-extract,vaccinium-angustifolium-fruit-extract,pinus-palustris-leaf-extract,ulmus-davidiana-root-extract,oenothera-biennis-flower-extract,pueraria-lobata-root-extract,hydrolyzed-hyaluronic-acid,ammonium-acryloyldimethyltaurate/vp-copolymer,allantoin,dipotassium-glycyrrhizate,beta-glucan,disodium-edta,hydroxyacetophenone",neutral,watery-brown,hot-humid,"oil-control,soothing,antioxidant,lightweight",both,daily,"ISNTREE Green Tea Fresh Toner is formulated with 80% of Green Tea Extract, Hyaluronic Acid, and Centella Asiatica Extract. The green tea is harvested from Jeju Island and is great to revitalize the skin. This Green Tea Fresh Toner also controls your oil, protects, brightens, and balances the skin. It works great with acne due to the Centella extracts inside and it moisturizes the skin. The Green Tea Fresh Toner is hypoallergenic and contains EWG green grade ingredients that are safe to use on the skin. Quantity: 200ml
","Reduces excess oil, tightens pores, soothes skin, restores balance.","After cleansing, apply to face with a cotton pad or hands. Pat to absorb.",4.8,41501956145187,7176833499171
TONERS,Isntree,Green Tea Fresh Toner 20ml - Mini,TRUE,Balancing Toner,? 250,20 ml,"combination,oily,sensitive",TRUE,"oiliness,pores,redness","green-tea-extract,anti-sebum-p,centella-asiatica","camellia-sinensis-leaf-extract,water,ginkgo-biloba-leaf-extract,centella-asiatica-extract,salix-alba-bark-extract,vaccinium-angustifolium-fruit-extract,pinus-palustris-leaf-extract,ulmus-davidiana-root-extract,oenothera-biennis-flower-extract,pueraria-lobata-root-extract,hydrolyzed-hyaluronic-acid,ammonium-acryloyldimethyltaurate/vp-copolymer,allantoin,dipotassium-glycyrrhizate,beta-glucan,disodium-edta,hydroxyacetophenone",neutral,watery,hot-humid,"travel-size,oil-control,soothing,refreshing",both,daily,"The Isntree Green Tea Fresh Toner is designed to rejuvenate and hydrate the skin, with the potent antioxidant properties of green tea. Sourced from the lush island of Jeju, the green tea extract helps to revitalize tired and stressed skin. By incorporating this toner into your daily skincare routine, you can enjoy the numerous benefits of green tea, from antioxidant protection to enhanced hydration and improved skin texture. Ideal for those seeking a natural, effective solution to maintain healthy, balanced, and youthful-looking skin.
","Controls excess sebum, soothes irritation, refreshes skin texture, travel-friendly.",Apply to face using hands or cotton pad. Pat to absorb.,4.6,41501956177955,7176833531939
MOISTURIZERS,AXIS-Y,Heartleaf My Type Calming Cream,TRUE,Gel Cream,"? 1,550",60 ml,"combination,oily,sensitive",TRUE,"dehydration,redness,sensitivity","heartleaf-extract,centella-asiatica,sorghum-bicolor,sage-extract","water,propanediol,glycerin,sodium-hyaluronate,butylene-glycol,sorbitol,isohexadecane,caprylic/capric-triglyceride,houttuynia-cordata-extract,betaine,centella-asiatica-extract,glyceryl-stearate,salvia-officinalis-(sage)-extract,glycyrrhiza-glabra-(licorice)-root-extract,sorghum-bicolor-leaf/stem-extract,aspergillus-ferment,chlorphenesin,arginine,acrylates/c10-30-alkyl-acrylate-crosspolymer,allantoin,sorbitan-sesquioleate,ethylhexylglycerin,xanthan-gum,guaiazulene",neutral,lightweight-gel,hot-humid,"vegan,cruelty-free,lightweight,soothing",both,daily,"???The AXIS-Y Heartleaf My Type Calming Cream is a lightweight, gel-type moisturizer formulated to soothe and hydrate irritated and dehydrated skin. It features key ingredients such as Heartleaf (Houttuynia Cordata) and Centella Asiatica, known for their anti-inflammatory and healing properties. The cream aids in strengthening the skin's natural barrier, enhancing resilience against environmental stressors. This cream is suitable for all skin types, especially those with sensitive, combination, or acne-prone skin. Its lightweight formulation makes it ideal for layering and provides a refreshing finish.","Soothes irritated skin, hydrates without heaviness, calms redness, suitable for layering.","Apply the desired amount of cream to the skin. For extra moisture, layer 2-3 times.",4.5,41501956210723,7176833531939
MOISTURIZERS,Cathy Doll,Hyaluron Vitamin E Milk Protein Body Lotion,TRUE,Body Lotion,? 999,450 ml,"dry,normal",TRUE,"dehydration,dryness,texture","hyaluronic-acid,vitamin-e,milk-protein","aqua,glycerin,cetearyl-alcohol,squalane,fragrance,dimethicone,phenoxyethanol,glyceryl-stearate,peg-100-stearate,methylparaben,acrylates/c10-30-alkyl-acrylate-crosspolymer,allantoin,triethanolamine,tocopherol,hydroxyethylcellulose,pentylene-glycol-butylene-glycol,milk-extract,sodium-acetylated-hyaluronate,sodium-hyaluronate,sodium-hyaluronate-crosspolymer-camellia-sinensis-leaf-extract,centella-asiatica-extract,chamomilla-recutita-(matricaria)-flower-extract,glycyrrhiza-glabra-(licorice)-root-extract,hydrolyzed-sodium-hyaluronate,polygonum-cuspidatum-root-extract,rosmarinus-officinalis-(rosemary)-leaf-extract,scutellaria-baicalensis-root-powder,1,2-hexanediol,ethylhexylglycerin",neutral,lotion,cold-dry,"moisturizing,softening,floral-scent,nourishing",both,daily,"Cathy Doll Hyaluron Vitamin E Milk Protein Body Lotion makes everyday body care simple and refreshing. This lightweight, non greasy lotion blends Hyaluronic acid, vitamin E, and milk protein to give your skin hydration, moisture, and an easy glow. The floral scent lasts all day, keeping you smelling fresh and nice without being too strong. With its moisturizing yet quick-absorbing texture, this Cathy Doll body lotion leaves skin soft, smooth, and glowing, while helping it look plump, healthy, and naturally radiant.","Deeply moisturizes, softens rough texture, improves elasticity, pleasant floral scent.",Apply all over the body daily.,4.5,41501956276259,7176833597475
SUNSCREENS,Isntree,Hyaluronic Acid Airy Sun Stick SPF50+ PA++++,TRUE,Sun Stick,"? 1,850",22 g,,TRUE,sun-protection,"8-types-hyaluronic-acid,bamboo-water,kelp-extract","water,polyethylene,propylheptyl-caprylate,c12-15-alkyl-benzoate,homosalate,silica,ethylhexyl-methoxycinnamate,neopentyl-glycol-diheptanoate,vinyl-dimethicone/methicone-silsesquioxane-crosspolymer,ethylhexyl-salicylate,butylene-glycol,synthetic-fluorphlogopite,niacinamide,diethylamino-hydroxybenzoyl-hexyl-benzoate,vinyl-dimethicone,bis-ethylhexyloxyphenol-methoxyphenyl-triazine,ozokerite,polyglyceryl-4-diisostearate/polyhydroxystearate/sebacate,pinus-pinaster-bark-extract,bambusa-vulgaris-water,mesembryanthemum-crystallinum-extract,hibiscus-sabdariffa-flower-extract,ceramide-np,glycerin,olea-europaea-fruit-oil,laminaria-japonica-extract,ulmus-davidiana-root-extract,aloe-barbadensis-leaf-extract,viola-mandshurica-flower-extract,dioscorea-japonica-root-extract,polyglyceryl-2-dipolyhydroxystearate,polyurethane-11,glyceryl-caprylate,sorbitan-sesquioleate,sodium-hyaluronate,adenosine,astaxanthin,pentylene-glycol,sodium-acetylated-hyaluronate,sodium-hyaluronate-crosspolymer,ascorbyl-propyl-hyaluronate,hydroxypropyltrimonium-hyaluronate,hydrolyzed-sodium-hyaluronate,hydrolyzed-hyaluronic-acid,hyaluronic-acid,triethoxycaprylylsilane,caprylyl-glycol,ethylhexylglycerin,1-2-hexanediol",neutral,solid-stick,all,"portable,matte-finish,cooling,easy-reapplication",morning,daily,"Enjoy a lightweight easy to apply sunscreen with the Isntree Hyaluronic Acid Airy SunStick!
","Portable sun protection, cools skin, leaves a matte finish, hydrates.",Glides directly onto the face and neck. Reapply every 2-3 hours.,4.4,41501956538403,7176833826851
MOISTURIZERS,Isntree,Hyaluronic Acid Aqua Gel Cream,TRUE,Gel Cream,"? 1,450",100 ml,"combination,oily",TRUE,"dehydration,dullness,oiliness","5-types-hyaluronic-acid,centella-asiatica,green-tea-extract,licorice-root-extract","water,methylpropanediol,coco--caprylate/caprate,1,2-hexanediol,glycerin,betaine,ammonium-acryloyldimethyltaurate/-vp-copolymer,trehalose,phenyl-trimethicone,isostearyl-alcohol,butylene-glycol-cocoate,hy--drogenated-olive-oil-unsaponifiables,hydro--lyzed-jojoba-esters,sodium-hyaluronate,so--dium-pca,butylene-glycol,allantoin,pentylene-glycol,ethylcellulose,bosaccharide-gum-1,hy--drolyzed-hyaluronic-acid,propanediol,xanthan-gum,squalane,centella-asiatica-extract,ce--tearyl-olivate,sorbitan-olivate,ethylhexylgly--cerin,sodium-hyaluronate-crosspolymer,scu--tellaria-baicalensis-root-extract,polygonum-cuspidatum-root-extract,camellia-sinensis-leaf-extract,glycyrrhiza-glabra-(licorice)-root-extract,portulaca-oleracea-extract,houttuynia-cordata-extract,hyaluronic-acid,chamomilla-recutitia-(matricaria)-flower-extract,rosmarinus-offi--cinalis-(rosemary)-leaf-extract,hydrolyzed-sodium-hyaluronate",neutral,lightweight-gel,hot-humid,"fragrance-free,oil-free,non-sticky,cooling",morning,daily,"The Isntree Hyaluronic Acid Aqua Gel Cream (100ml) is a cult-favorite for good reason — it's a summer skincare savior, especially for oily, combination, and dehydrated skin types. It’s your daily hydration hero — lightweight, calming, hydrating, non-greasy, and generously sized. Here’s why this lightweight cream has such a strong fan base:
","Deeply hydrates without heaviness, soothes irritation, replenishes moisture, controls oil.",Apply a generous amount to the face and neck after toning/serum. Massage gently.,4.6,41501956309027,7176833630243
MOISTURIZERS,COSRX,Hyaluronic Acid Intensive Cream,TRUE,Face Cream,"? 1,650",100 ml,"dry,normal",TRUE,"dehydration,dryness,dullness","hippophae-rhamnoides-water,hyaluronic-acid,betaine","hippophae-rhamnoides-water,glycerin,butylene-glycol,caprylic/capric-triglyceride,betaine,helianthus-annuus-seed-oil,cetearyl-alcohol,cetearyl-olivate,sorbitan-olivate,macadamia-ternifolia-seed-oil,1-2-hexanediol,sodium-hyaluronate,arginine,panthenol,dimethicone,ethylhexylglycerin,carbomer,allantoin,xanthan-gum",neutral,rich-cream,cold-dry,"deep-hydration,plumping,non-greasy,moisturizing",evening,daily,"Experience deep hydration with the COSRX Hyaluronic Acid Intensive Cream. This moisturizer is formulated to boost your skin's moisture content, sealing it in to prevent further loss and ensure long-lasting hydration. ?","Deeply moisturizes, prevents moisture loss, plumps skin, non-greasy finish.",Apply a proper amount onto face after cleansing and toning. Tap gently for absorption.,4.8,41501956341795,7176833663011
